id,merchant_id,address,name,city,rating,fave_paycnt
4111,32540,"No 63, Jalan Pasar, 34000 Taiping, Perak",Yat Sun Restaurant,taiping,4.5,217
4112,33327,Bukit Merah Lake Town Resort,About Travel (Bukit Merah Lake Town Resort),taiping,0,0
4113,33773,"Lot 8576 & 8577, Jalan Kamunting, 34000 Taiping, Perak",GINTELL,taiping,4.6,0
4114,35466,"Lot F-10 & F-11, First Floor, AEON Mall Taiping, Jalan Kamunting, 34600 Taiping, Perak Darul Ridzuan",BASKIN-ROBBINS,taiping,4.7,0
4115,35799,"S9,Second Floor,Tesco Taiping, Lot38,Jalan Istana Larut, 34000 Taiping.",XES,taiping,0,0
4116,35814,"Lot 1.23,1.23A & 1.25 Taiping Mall, Jalan Tupai ,34000 Taiping ,Perak.",XES,taiping,0,0
4117,35480,"Lot G-16, Ground Floor, Taiping Mall Jalan Tupai, 34000 Taiping, Perak Darul Ridzuan.",BASKIN-ROBBINS,taiping,4.7,0
4118,35952,"61, Jalan Pasar, Taiping, Perak, Malaysia",Nagaria Steak House,taiping,0,0
4119,11658,"19-C, 1st Floor, Jalan Kg. Raja, 31600, Gopeng Malaysia",Riverbug,kampar,5,0
4120,28180,"2288, Jalan Hala Timah 1, Taman Kolej Perdana Kampar, Perak",Garden Cottage,kampar,4.6,97
4121,22882,"2333, Ground Floor, Jalan Hala Timah, Taman Bandar Baru, 31900 Kampar, Perak.",Vic Hair and Make Up Studio,kampar,5,5
4122,23353,"49-51, GF Pusat Perdagangan, Jalan Kampar Barat 1, Taman Kampar Barat, 31900 Kampar, Perak.",Orange Fitness Centre,kampar,0,4
4123,23227,"2188, Jalan Timah, Bandar Baru Kampar, Kampar, 31900",GK Cafe,kampar,0,2
4124,23229,"2188, Jalan Timah, Bandar Baru Kampar, Kampar, 31900",The Mines Chinese Restaurant @ Grand Kampar Hotel,kampar,0,0
4125,17391,"18A, 1st Floor, JalanBatu Karang, Tmn Baru Kampar 
31900 Kampar, Perak",KB Dot My Cafe,kampar,4.8,459
4126,21759,"Lot No. 5&6, Ground Floor, Tin Village Mall, Taman Bandar Baru, 31900 Kampar, Perak",Starbucks,kampar,4.4,0
4127,22509,"No 2365, Jalan Hala Timah 3, Taman Bandar Baru , 31910 Kampar Perak",Fame House Cafe,kampar,5,35
4128,22463,"27， Jalan Post Office, Taman Tasik Emas, 31900 Kampar",Ori Spice House,kampar,3.9,182
4129,22485,"
Jalan Batu Sinar
Kampar, Perak 31900",Villa21 Cafe,kampar,4.8,1013
4130,21801,"Shell Tapah R&R North Bound, Kawasan Rehat & Rawat, Arah Utara, Lebuhraya Utara Selatan 35000 Tapah,Perak",Starbucks,kampar,4.4,0
4131,22419,"21, 21-A, Jalan Batu Karang, 31900 Kampar, Perak",Ah Boy Noodle 阿BOY面馆,kampar,4.6,1294
4132,22426,"2193, Jalan Timah, Taman Kolej Perdana, 31900 Kampar, Negeri Perak, Malaysia",Vegan Life Kampar,kampar,4.6,428
4133,22440,"2347, Jalan Hala Timah 2, Taman Bandar Baru, 31900 Kampar, Perak",OC Bakery,kampar,4.8,496
4134,22431,"16 Jalan Batu Karang , Off Jalan Baru Sinar, 31900 Kampar Perak",Lov3 Bar & Bistro,kampar,0,7
4135,17696,"2334, jalan hala timah 1, taman bandar baru Kampar, Perak",Eggette Pop,kampar,5,35
4136,17694,"2236 jalan batu sinar, taman bandar baru, Kampar, Perak",Sweet Hug House,kampar,4.6,324
4137,28792,"Lot No. G19, Grd Flr, Tesco Kampar, Jln Kampar Perdana, Tmn Kampar Perdana, 31900 Kampar, Perak",GINTELL,kampar,4.6,0
4138,32742,"8, Jalan Batu Karang, Taman Bandar Baru, 31900 Kampar, Perak.",The Black Whale 黑鲸 ,kampar,4.5,1270
4139,32722,"G-9-c,tesco, 31900 Kampar, Negeri Perak",APPLE ID UNLOCKED,kampar,0,0
4140,35474,"Lay Bys Bidor, KM347.4, KM347.4, Lebuhraya Utara Selatan, 35600 Bidor, Perak Darul Ridzuan.",BASKIN-ROBBINS,kampar,4.7,0
4141,35482,"Tapah Southbound Rest And Service Area, Lot Type C1, Lebuhraya Ipoh - Bidor, 35000 Perak Darul Ridzuan.",BASKIN-ROBBINS,kampar,4.7,0
4142,35820,"Giant Superstore Kampar. Lot G7 & G8 ,PT 32060 Jalan Persekutan Ipoh,Kampar,31900 Kampar, Perak Darul Ridzuan.",XES,kampar,0,0
4143,34319,"Lot 554, 555 & 583 Jalan Baru, Taman Tasik Emas, 31900 Kampar, Perak Malaysia",mmCineplexes Malaysia,kampar,4.6,0
4144,35481,"Kawasan Rehat dan Rawat TAPAH, Arah Utara KM 331.8, Lebuhraya Ipoh - Bidor, 35000 Perak Darul Ridzuan.",BASKIN-ROBBINS,kampar,4.7,0
4145,34652,"ECONSAVE SRI ISKANDAR, IKD KS 04, 32600 BOTA, PERAK",Coolblog,kampar,4.6,0
4146,34654,"TESCO KAMPAR, G-03, GROUND FLOOR, JALAN PERDANA, TAMAN KAMPAR PERDANA, 31900 KAMPAR, PERAK",Coolblog,kampar,4.6,0
4147,36344,"A-G-5, Level G, Westlake Villas, Jalan Batu Sinar, Bandar Barat, 31900 Kampar, Perak.",Secret Coffee,kampar,0,1
4148,17367,"Lot G62 & G63, Ground Floor, AEON Seri Manjung Shopping Centre, Pusat Perniagaan Manjung Point 3, 32040 Seri Manjung, Perak Darul Ridzuan",Kenny Rogers ROASTERS,sitiawan,4,0
4149,19851,"Lot G38, Ground Floor, AEON Seri manjung Shiopping Centre, Pusat Perniagaan Manjung Point 3. 32040 Seri manjung, Perak.",SODA,sitiawan,4.6,68
4150,19810,"Lot G41, Ground Floor, AEON Seri manjung Shiopping Centre, Pusat Perniagaan Manjung Point 3.32040 Seri manjung, Perak.",VOIR,sitiawan,4.5,272
4151,20016,"Lot G80, Ground Floor, AEON Seri Manjung Shopping Centre, Pusat Perniagaan Manjung Point 3, 32040 Seri Manjung, Perak.",Auntie Anne’s,sitiawan,4.5,335
4152,21755,"Lot G65, AEON Seri Manjung Shopping Centre, Pusat Perniagaan Manjung Point 3, 32040 Seri Manjung, Perak",Starbucks,sitiawan,4.4,0
4153,23158,"AEON Seri Manjung Shopping Centre, Pusat Perniagaan Manjung Point 3, 32040. Seri Manjung, Perak Darul Ridzuan.",Cosas United,sitiawan,4.7,2
4154,6444,"14 (Tingkat Bawah), Taman Sitiawan Satu, Jln Lumut, 32000 Sitiawan",Pathlab,sitiawan,3.8,0
4155,29028,"Lot R01, Ground Floor, Jusco Seri Manjung 32040 Seri Manjung, Perak shopping Centre, Pusat Perniagaan Manjung Point 3",SHINE SHINE,sitiawan,4.7,0
4156,31027,"67, Taman Hijau 2, 32000 Sitiawan, Perak.",Yau Teck Construction Works,sitiawan,0,6
4157,27453,"AEON Mall Seri Manjung, Seri Manjung, Perak, Malaysia",Mp colourful Accessory ,sitiawan,5,5
4158,25166,"No 255 & 256, Jalan PPMP 3/4 Pusat Perniagaan. Manjung Point Seksyen 3, Seri Manjung,  Perak",Big Whale Cafe,sitiawan,4.7,1324
4159,25755,"No.210 & 211 Pusat Perniagaan Point III Perak., 32040 Seri Manjung, Perak",Restoran Thai Tomyam Kung Sitiawan,sitiawan,4.4,343
4160,25768,"No.128, Ground Floor  Jalan Ppmp 3/3, Pusat Perniagaan Manjung Point 3, 3204, Seri Manjung Perak",TBH The Baker's Hut,sitiawan,4.5,1554
4161,25914,"Lot 16033 (no. 9 & 10), Jalan Besar, Pusat Perniagaan Manjung Point 3, 32040 Sri Manjung, Perak.",PappaRich Sri Manjung,sitiawan,4.2,212
4162,25867,"31, Tingkat 1, Pusat Bandar Seri Manjung, 32040 Seri Manjung, Perak.",Gathering House Cafe,sitiawan,4.6,62
4163,25869,"21-25 PSN PM/1, Pusat Bandar Seri Manjung, 302040 Seri Manjung Perak.",Ikeano Home Concept,sitiawan,0,1
4164,25841,"120, Ground floor, Wisma Ganda, 32000 Sitiawan, Perak.",Kelapapa,sitiawan,4.8,264
4165,25883,"No.2477, Lot M11, Jalan Dato Yu Neh Huat, Seri Manjung Perak.",TBH The Baker's Hut,sitiawan,4.5,156
4166,25882,"1. No:52, Taman Ria Jaya, Jalan Raja Omar, 32000 Sitiawan, Perak  ",TBH The Baker's Hut,sitiawan,4.5,1524
4167,28244,"99&100, Jalan Lumut Medan Sejahtera, 32000 Sitiawan,Perak",Light World,sitiawan,5,10
4168,24940,"No. 403 & 403A, Jln Samudera 2, Taman Samudera, 32040 Seri Manjung, Perak",COURTS Malaysia,sitiawan,3.9,0
4169,27616,"89, Jalan Sejahtera, Medan Sejahtera 2, 32000 Sitiawan, Perak.",Miss U Cafe,sitiawan,4.6,141
4170,27619,"40-43, Pusat Perniagaan Manjung Point 3, 32040 Sri Manjung, Perak.",KING & CO,sitiawan,0,2
4171,27522,"no 33, Persiaran Pm 2/3, Pusat Bandar Seri Manjung Seksyen 3, Sitiawan, Perak, Malaysia",Superwoman Cleaning And Services,sitiawan,0,1
4172,27525,"no 77, Jalan Sejahtera 2, Sitiawan, Perak, Malaysia",FELICITA HOMES DECO,sitiawan,0,1
4173,25464,"35&37, Jalan Lumut, 32000 Sitiawan, Perak.",Kobe Bistro,sitiawan,4.8,313
4174,25463,"21, Jalan Sentral 2, Sitiawan Sentral, 32000 Sitiawan, Perak.",Kobe Bistro,sitiawan,4.8,482
4175,25739,"107, Persiaran PM 2/5, Pusat Bandar Seri Manjung Seksyen II, 32040 Seri Manjung, Perak.",Judy & Coco Cafe,sitiawan,4.8,59
4176,25445,"56, Persiaran PM 2/4, Pusat Bandar Seri Manjung Seksyen 2, 32040 Seri Manjung, Perak.",Jook 2- Jook Joint Bistro,sitiawan,3.8,63
4177,25439,"13, Jalan Sentral 3, Sitiawan Sentral, 32000 Sitiawan, Perak.",二楼 Second Floor 2 Cafe,sitiawan,4.6,205
4178,25447,"46, Jalan Ria Jaya 1, Taman Ria Jaya, 32000 Sitiawan, Perak.",Tastea Cafe,sitiawan,4.4,62
4179,25448,"138-139, Taman Berpadu, 32000 Sitiawan, Perak.",Garden Cottage,sitiawan,4.6,723
4180,25441,"1, Jalan Lumut, Taman Sitiawan Maju, 32000 Sitiawan, Perak.",The Farm Cafe,sitiawan,4.7,249
4181,25357,"152, Jalan PPMP 3/3, Pusat Perniagaan Manjung Point 3, 32040 Seri Manjung, Negeri Perak",HARUMi,sitiawan,4.6,112
4182,32562,"13a, Hala Pantai Emas 1, taman pantai emas
34900 pantai remis perak",LA MODE HAIR & MAKE UP STUDIO,sitiawan,5,2
4183,34656,"OLF04, JALAN LUMUT, 32000 SERI MANJUNG, NEGERI PERAK",Coolblog,sitiawan,4.6,0
4184,34649,"LOT GF-41, FIRST FLOOR, NO: 5260 , JALAN LUMUT, 32040 SERI MANJUNG, PERAK DARUL RIDZUAN.",Coolblog,sitiawan,4.6,0
4185,35825,"Lot : F10,Tesco Manjung, Lot 16051,Mukim Sitiawan, Daerah Manjung, 32040 Manjung,Perak.",XES,sitiawan,0,0
4186,35798,"AEON Seri Manjung Shopping Centre Lot F01,Pusat Perniagaan Manjung point 3,32040 Seri Manjung,Perak.",XES,sitiawan,0,0
4187,35645,"no. 5, Jalan Raja Omar, Taman Arasu, 32000 Sitiawan, Perak, Malaysia",Breakie Brunch Noodle,sitiawan,0,0
4188,18205,"Sutera Mall, L2018A, Jalan Sutera Tanjung 8/4, Taman Sutera Utama, 81300 Skudai, Johor, Malaysia",Snow ST (榴芒武馆),johor-bahru,4.5,0
4189,16968,"28, Jln Harmonium 24/2, Taman Desa Tebrau, 81100 Johor Bahru, Johor, Malaysia",Velvety Beauty Waxing Studio,johor-bahru,5,0
4190,17949,"Lot. UG-23A, Upper Ground Floor, Paradigm Mall Johor Bahru Jalan Skudai, 81200 Johor Bahru.",Kenny Rogers ROASTERS,johor-bahru,4,0
4191,17968,"Lot 1D (A), 2D & 3D, Little Red Cube, Persiaran Puteri Selatan, Puteri Harbour, 79000 Nusajaya, Johor Bahru.",Kenny Rogers ROASTERS,johor-bahru,4,0
4192,17962,"Lot G-6, Ground Floor, AEON Bukit Indah Shopping Centre, No.8, Jalan Indah 15/2, Bukit Indah, 81200 Johor Bahru",Kenny Rogers ROASTERS,johor-bahru,4,0
4193,17965,"Lot. S20 & S21, 2nd Floor, Aeon Tebrau Shopping Centre, No.1, Jalan Desa Tebrau, Taman Desa Tebrau, 81100 Johor Bahru, Johor.",Kenny Rogers ROASTERS,johor-bahru,4,0
4194,17925,"Sutera Mall, 1, Jalan Sutera Tanjung 8/4, Taman Sutera Utama, 81300 Skudai, Johor, Malaysia",Vintage Studio Academy Malaysia,johor-bahru,4.6,0
4195,18017,"65-02, Jalan Mutiara Emas 2A, Taman Mount Austin, 81100 Johor Bahru, Johor. ",Shoe Mo,johor-bahru,4.8,30
4196,13795,"12A-01, Jalan Austin Height 3/2, Taman Mount Austin, 81100 JB, johor",e@robotclub Robotic Class,johor-bahru,4.3,0
4197,14224," 85 Jalan Beringin, Taman Melodies, 80250 Johor Bahru.",THE MARINE KITCHEN,johor-bahru,4.9,15
4198,14200,"G43, Ground Floor,  AEON Mall Kulai Jaya,  PTD 106273, Persiaran Indahpura Utama, Bandar Indahpura,  81000 Kulai Jaya, Johor.",Auntie Anne’s,johor-bahru,4.5,426
4199,14201,"5, Johor Bahru City Centre, Bandar Johor Bahru, 80000 Johor Bahru, Johor, Malaysia",Auntie Anne’s,johor-bahru,4.5,645
4200,14226," Forest City, Johor Bahru",Ridiculous Obstacle Challenge (ROC Race),johor-bahru,0,0
4201,14199,"G46, Ground Floor, AEON Bukit Indah Shopping Centre Jalan Indah 15/2, Bukit Indah, 81200, Johor Bahru.",Auntie Anne’s,johor-bahru,4.5,813
4202,14162,"Jalan Austin Heights Utama, Taman Mount Austin, 81100 Johor Bahru, Johor, Malaysia",Mexicano House,johor-bahru,4.2,52
4203,14182,"L1-84, Sutera Mall, No. 1 Jalan Tanjung 8/4, Taman Suera Utama, 81300 Skudai, Johor.",Italiano Espresso Bar,johor-bahru,4.4,196
4204,14204,"LG42, AEON Bukti Indah, 8, Jalan Indah 15/2, Taman Bukit Indah, 81200 Johor Bahru, Johor",Taste Better,johor-bahru,4.5,374
4205,14203,"L2-S12, KSL City Mall, Jalan Seladang, Taman Abad, 80250 Johor Bahru, Johor",Taste Better,johor-bahru,4.5,96
4206,14172," No52-G, Jln Pertama 1, Danga Utama Jalan Sutera Danga, 81300 Johor Bahru, Johor.",Yeoh's Bak Kut Teh,johor-bahru,4.6,1475
4207,15152,"G05, Plaza Mentari, 80400 Johor Bahru, Johor, Malaysia",Living Room Cafe,johor-bahru,4.7,30
4208,15198,"Aeon Tebrau City Shopping Centre, Taman Desa Tebrau, 81100 Johor Bahru, Johor, Malaysia",Samurai Ramen Unami,johor-bahru,4,185
4209,18701,"1, Jalan Harmonium 35/1, Taman Mount Austin, 81100 Johor Bahru, Johor, Malaysia",Ah Gong Laksa 阿公辣沙,johor-bahru,4.4,587
4210,18703,"14, Jalan Layang 16, Taman Perling, 81200 Johor Bahru, Johor, Malaysia",Han She 寒舍家宴,johor-bahru,4.7,808
4211,18616,"35, Jalan Harmonium 23/13, Taman Desa Tebrau, 81100 Johor Bahru, Johor, Malaysia",A Tempo Cafe,johor-bahru,4.9,79
4212,17879,"40 Jalan Pendekar 10 Taman Ungku Tun Aminah Skudai, Johor, Malaysia 81300",ANE.J,johor-bahru,4.8,0
4213,17903,"147, Jln Mutiara Emas 10/19, Taman Mount Austin, 81100 Johor Bahru, Johor, Malaysia",gCafe Mount Austin,johor-bahru,4.3,154
4214,17854,"No. 17, Jalan Pendekar 9,Taman Ungku Tun Aminah, 81300 Skudai, Johor, Malaysia",V Spice Cafe & Restaurant,johor-bahru,4.4,78
4215,17912,"Jalan Dato' Onn 3, Kawasan Perindustrian Tebrau 3, 81100 Johor Bahru, Johor",Sorella,johor-bahru,4.6,0
4216,17904,"Lot S22, 2nd floor, AEON Tebrau City 
Tebrau, Johor, Malaysia 81100",Oleg,johor-bahru,3.2,62
4217,17856,"Crystal Crown Hotel, Taman Century, 80250 Johor Bahru, Johor, Malaysia",Kirishima Shuzou,johor-bahru,4.7,373
4218,17852,"81200, Jalan Bertingkat Skudai, Skudai, 81200 Johor Bahru, Johor, Malaysia",Blue Ice Skating Rink,johor-bahru,4.8,0
4219,17409,"No 1,Jalan Ekoflora 1,Taman Ekoflora ,Johor Bahru 81100",93 Bangkok Coffee,johor-bahru,4.1,51
4220,17338,"Lot G-6, Ground Floor, No.1, Persiaran Desa Tebrau, Taman Desa Tebrau, 81100 Johor Bahru",Kenny Rogers ROASTERS,johor-bahru,4,0
4221,17339,"Lot No. 1-29 & 1-30, Level 11, Berjaya Waterfront Complex Johor Bahru, No.88, Jln Ibrahim Sultan, Stulang Laut,80300, Johor Bahru, Johor.",Kenny Rogers ROASTERS,johor-bahru,4,0
4222,17204,"29-17 Ground Floor Jalan Pesta 1/2, Kampung Kenangan Tun Dr Ismail 84000 Muar Johor",Sorella,johor-bahru,4.6,42
4223,17207,"Lot B-15 Giant Plentong, No.3 Jln Masai Lama, Mukim Plentong, 81750 Masai,  JB.",Sorella,johor-bahru,4.6,17
4224,17203,"Lot 2-22, Wetex Parade, Jln Ali, 84000 Muar , Johor.",Sorella,johor-bahru,4.6,33
4225,17208,"M3-18, Level 3, 108 Jalan Wong Ah Fok, City Square, 80000 Johor Bahru, Johor.",Sorella,johor-bahru,4.6,140
4226,17206,"GK 13, Ground Floor, 1Segamat Shopping Centre, Jalan Kolam Air, Kampung Gubah, 85000 Segamat, Johor",Sorella,johor-bahru,4.6,13
4227,17205,"G87, IOI Mall, Bandar Putra, 81000 Senai, Johor.",Sorella,johor-bahru,4.6,0
4228,17237,"Sutera Mall, 1, Jalan Sutera Tanjung 8/4, Taman Sutera Utama, 81300 Skudai, Johor, Malaysia",Dum Dum Thai Drinks Malaysia,johor-bahru,4.6,567
4229,18746,"51, Jalan Sentral 2, Taman Nusa Sentral, 79100 Iskandar Puteri, Johor",Interaid Pharmacy,johor-bahru,4.8,43
4230,18801,"LG-20, Jalan Ponderosa 2/1, Taman Ponderosa, 81100 Johor Bahru, Johor, Malaysia",Kakou Cafe,johor-bahru,4.7,74
4231,17489,"No89-1 Jalan Mutiara Emas 2A, Taman Mount Austin, 81100 Johor Bahru, Johor, Malaysia",Jusu Korean Dessert Cafe,johor-bahru,4.6,226
4232,17487,"NO117, Jalan Mutiara Emas 2A, Taman Mount Austin, 81100 Johor Bahru, Johor, Malaysia",Traditional History 温馨潮州,johor-bahru,5,13
4233,17459,"No 8,Jalan Balau, Taman Melodies, Johor Bahru 80250",Mee Rebus House,johor-bahru,4.5,232
4234,17454,"53, jalan dataran larkin 1, taman dataran larkin, 80350 Johor Bahru, Johor",The Substitutes,johor-bahru,4.6,36
4235,17193,"1F-05, 76, Jalan Mewah Ria 2/2, Taman Bukit Mewah, 81200 Johor Bahru",Sorella,johor-bahru,4.6,1
4236,17197,"Lot L1-133,KSL City,No 33 Jalan Seladang, Tmn Abad,80250 Johor Bahru, Johor.",Sorella,johor-bahru,4.6,33
4237,17199,"Lot L3-021A, Level 3,Sutera Mall, No 1,Jln Sutera Tanjung 8/4 ,Tmn Sutera Utama,81300 Skudai Johor",Sorella,johor-bahru,4.6,38
4238,17232,"2, Jalan Kuning, Taman Pelangi, 80400 Johor Bahru, Johor, Malaysia",Dum Dum Thai Drinks Malaysia,johor-bahru,4.6,272
4239,17239,"Giant Hypermarket, Johor Jaya, 81100 Masai, Johor, Malaysia",Dum Dum Thai Drinks Malaysia,johor-bahru,4.6,84
4240,17233,"Paradigm Mall Jalan Bertingkat Skudai, 81200 Johor Bahru, Johor, Malaysia",Dum Dum Thai Drinks Malaysia,johor-bahru,4.6,894
4241,17236,"Plaza Angsana, 1, Jalan Tampoi, Bandar Baru Uda, 81200 Johor Bahru, Johor, Malaysia",Dum Dum Thai Drinks Malaysia,johor-bahru,4.6,17
4242,17234,"30, Jalan Austin Heights 8/9, 81100 Johor Bahru, Johor, Malaysia",Dum Dum Thai Drinks Malaysia,johor-bahru,4.6,293
4288,18496,"9, Jalan Harmonium 9, Taman Desa Tebrau, 81100 Johor Bahru, Johor, Malaysia",Athene Christyn Beauty,johor-bahru,0,0
4243,17240,"KSL City Mall Branch, 33, Jalan Seladang, Taman Abad, 80250 Johor Bahru, Johor, Malaysia",Dum Dum Thai Drinks Malaysia,johor-bahru,4.6,189
4244,17221,"Pulai Springs Resort. 20km, Jalan Pontian Lama, 81110 Pulai, Johor",Pulai Springs Resort,johor-bahru,0,0
4245,17235,"Mydin Mall Mutiara Rini, Jalan Jaya 1, Mutiara Rini, 81300 Skudai, Johor, Malaysia",Dum Dum Thai Drinks Malaysia,johor-bahru,4.6,54
4246,17389,"Lot 73A, Level G, Jalan Skudai, 81200 Johor Bahru, Johor",Starbucks,johor-bahru,4.4,870
4247,17327,"Jalan Desaru, Desaru, 82200 Bandar Penawar, Johor, Malaysia",Lotus Desaru Resort Beach & Spa (F&B),johor-bahru,3.3,0
4248,17585,:No 15 Jalan Keembong 49 Taman Johor Jaya 81100,WQ Skin Beauty,johor-bahru,4.6,0
4249,18431,"Lot F115B, 1st Floor, AEON Mall Tebrau City, No.1, Jalan Desa Tebrau, 81100 Johor Bahru, Johor",AsterSpring,johor-bahru,4.6,0
4250,18394,"27-A, JALAN SUTERA TANJUNG 8/3, TAMAN SUTERA UTAMA, 81300 SKUDAI, JOHOR",Aspetto Beauty House,johor-bahru,5,0
4251,18430,"Lot G21, Ground Floor, AEON Mall Kota Bharu, Lorong Bawah Lembah, 15050 Kota Bahru, Kelantan, Malaysia",AsterSpring,johor-bahru,4.6,0
4252,18432,"Lot F23, 1st Floor, AEON Bukit Indah Shopping Centre, No.8, Jalan Indah 15/2, Taman Bukit Indah, 81200 Johor Bahru, Malaysia",AsterSpring,johor-bahru,4.6,0
4253,18466,"Lot S19, 2nd Floor, Aeon Mall Bandar Dato Onn, Jln Dato' Onn 3, 81100 Johor Bahru, Johor, Malaysia",Arashi Shabu Shabu 岚新概念日式火锅,johor-bahru,4.4,295
4254,18465,"Lot F 10, Level 1, Aeon Bukit Indah Shopping Center, Jalan Indah 15/2, Taman Bukit Indah, 81200 Johor Bahru, Johor, Malaysia",Arashi Shabu Shabu 岚新概念日式火锅,johor-bahru,4.4,708
4255,18467,"Lot 19-20, Level 3, Paradigm Mall, Jalan Bertingkat Skudai, Skudai, 81200 Johor Bahru, Johor, Malaysia",Arashi Shabu Shabu 岚新概念日式火锅,johor-bahru,4.4,913
4256,18461,"LOT LG 01, Level Lower Ground, KSL City , 33, Jalan Seladang, Taman Abad, 80250 Johor Bahru, Johor, Malaysia",Kinsahi Japanese Restaurant 金旭日本料理,johor-bahru,4.3,233
4257,18464,"LOT S 113, 2nd floor, Aeon Tebrau City Shopping Centre, Taman Desa Tebrau, 81100 Johor Bahru, Johor, Malaysia",Arashi Shabu Shabu 岚新概念日式火锅,johor-bahru,4.4,1144
4258,18463,"Lot No. R132 & R133, Giant Hypermarket Plentong, Plentong, Johor, Malaysia 81750",Yum Yum Shabu Giant Plentong,johor-bahru,4.3,111
4259,18457,"Lot S115, 2nd Floor, Aeon Tebrau City Shopping Centre, 1 Jalan Desa Tebrau, Taman Desa Tebrau, 81100 Johor Bahru, Johor",Kinsahi Japanese Restaurant 金旭日本料理,johor-bahru,4.3,804
4260,18459,"T0-54, level 3,Persiaran Southkey 1, 81100 Johor Bahru, Johor, Malaysia",Kinsahi Japanese Restaurant 金旭日本料理,johor-bahru,4.3,16
4261,18460,"Lot 3F-18 , 3rd Floor, Paradigm Mall(Johor Bahru), Jalan Skudai, Skudai, 81200 Johor Bahru, Johor, Malaysia",Kinsahi Japanese Restaurant 金旭日本料理,johor-bahru,4.3,544
4262,18458,"Lot F09,Level 1, Aeon Bukit Indah Shopping Center , No8 , Jalan Indah 15/2 Taman Bukit Indah, 81200 Johor Bahru, Johor, Malaysia",Kinsahi Japanese Restaurant 金旭日本料理,johor-bahru,4.3,535
4263,18462,"LOT S26, 2nd Floor , Aeon Tebrau City Shopping Centre, Taman Desa Tebrau, 81100 Johor Bahru, Johor, Malaysia",ZEN Taiwanese Restaurant 珍品轩台式馆,johor-bahru,4.4,470
4264,18470,"Lot 215& 216 Level 2,Komtar JBCC, Jalan Wong Ah Fook, Bandar Johor Bahru, 80000 Johor Bahru, Johor, Malaysia",Arashi Shabu Shabu 岚新概念日式火锅,johor-bahru,4.4,410
4265,18468,"Lot L1-01, Level 1, KSL City Mall  33, Jalan Seladang, Taman Abad, 80250 Johor Bahru, Johor, Malaysia",Arashi Shabu Shabu 岚新概念日式火锅,johor-bahru,4.4,352
4266,18469,"Lot MB 03-05, Level B1, Level 1, City Square Mall  , Jalan Wong Ah Fook, Bandar Johor Bahru, 80000 Johor Bahru, Johor, Malaysia",Arashi Shabu Shabu 岚新概念日式火锅,johor-bahru,4.4,203
4267,16992,"Block 8A-G02, Bestari Terrace, Jalan Bestari 16/2, Johor Bahru 79150.",Elegante Beaute Plus,johor-bahru,0,0
4268,17718,"Lot PTB 22819, Jalan Skudai, Mukim Bandar Johor Bahru, 80200 Johor Bahru, Johor.",Tune Hotels Malaysia,johor-bahru,0,0
4269,17759,"Lot G22 Giant Nusa Bestari,Taman nusa Bestari ,79150 Iskandar Puteri ",TOTORO HAIR STUDIO,johor-bahru,4.8,0
4270,17757,"No.08-01, Jalan Molek 1/10 Taman Molek 81100 Johor Bahru",H TAG FASHION MAKEUP BEAUTY,johor-bahru,4.6,0
4271,18310,"22, Jalan Indah 15/1, Taman Bukit Indah, 81200 Johor Bahru, Johor",KLC Language Centre,johor-bahru,0,0
4272,18313,"25, Jalan Setia Tropika 1/30, Taman Setia Tropika, Taman Setia Tropika, 80300 Johor Bahru, Johor",KLC Language Centre,johor-bahru,0,0
4273,18303,"18, Jalan Molek 1/5B, Taman Molek, 81100 Johor Bahru, Johor, Malaysia",KLC Language Centre,johor-bahru,0,0
4274,18314,"15, Jalan Harmonium 23/14, Taman Desa Tebrau, 81100 Johor Bahru, Johor",KLC Language Centre,johor-bahru,0,0
4275,18315,"43, Jalan Pendekar 15, Taman Ungku Tun Aminah, 81300 Skudai, Johor, Malaysia",KLC Language Centre,johor-bahru,0,0
4276,18330,"32, Jalan Sutera Tanjung 8/3, Taman Sutera Utama, 81300 Skudai, Johor, Malaysia",The Ice Cream Bar,johor-bahru,4.6,468
4277,18350,"No 17 ground floor,Jalan perjiranan 15/1,bandar onn,81100,johor bahru,Johor",17 Bak Kut Teh,johor-bahru,0,2
4278,18269,"
No. 1, Jalan Camar 1/1, Taman Perling  Johor Bahru 81200",Yorokobi Bento House,johor-bahru,4.2,65
4279,18346,"Lot no. 3F-31 (Unit)  & 3F-31A, Third Floor, Paradigm Mall Johor, 81200, Jalan Bertingkat Skudai, Skudai, 81200 Johor Bahru, Johor, Malaysia",DipNDip,johor-bahru,4.5,183
4280,18261,"
No 22 jalan dedap 24,taman johor jaya 81100 Johor Bahru 81100",The Story Juice Bar & Cafe,johor-bahru,4.7,480
4281,17341,"LG-02 & LG-03, Lower Ground, Galleria@Kotaraya, Jalan Trus, 80000 Johor Bahru, Johor.",Kenny Rogers ROASTERS,johor-bahru,4,0
4282,17390,"99, Jalan Sutera Tanjung 8/3, Taman Sutera Utama, Skudai, Johor, Malaysia 81300",Doi Chaang (Sutera Utama),johor-bahru,4.6,148
4283,17539,"LG-21, Level LG KSL City, No 33, Jln Seladang, Taman Abad, 80250, Johor Bahru, Johor ,Johor Bahru 80250",Grandma Ong,johor-bahru,4.5,1373
4284,17604,"Jalan Eka, Horizon Hills, 79100 Nusajaya, Johor, Malaysia",Cathay Restaurant 新国泰酒楼,johor-bahru,4.2,18
4285,17542,"
L2-550,sutera mall, skudai  Johor Bahru 81300",7Dish Cafe,johor-bahru,4.3,654
4286,17538,"330, Jalan Kenanga 29/9, Bandar Indahpura  Kulai 81000",Grandma Ong,johor-bahru,4.5,791
4287,18552,"45, Jalan Mutiara emas 2A, Taman Mount austin, 81100 Johor Bahru, Malaysia.",UR SKIN,johor-bahru,4.6,1
4289,18551,"Lot L3-045, Level 3 (East Wing), Sutera Mall.  No 1, Jalan Sutera Tanjung 8/4,  Taman Sutera Utama  81300 Skudai, Johor Bahru, Malaysia.",UR SKIN,johor-bahru,4.6,1
4290,16111,"Lot No.1&2, 3rd Floor, JB Sentral, Jalan Jim Quee, 80300 Johor Bahru.",Starbucks,johor-bahru,4.4,523
4291,16112,"Suite/Lot 500, Johor Premium Outlets, Jalan Premium Outlets, Indahpura, 81000 Kulaijaya, Johor Darul Takzim.",Starbucks,johor-bahru,4.4,475
4292,16108,"Lot 1.31,1.31A,1.31B,1.32,1.33, Level 1 The Zone Johor Bharu 88 Jalan Ibrahim Sultan, Stulang Laut , 80300 Johor Bharu, Johor.",Starbucks,johor-bahru,4.4,169
4293,16114,"Lot 1D, Ground Floor, Little Red Cube,Persiaran Puteri Selatan, Puteri Harbour, 79000 Nusajaya, Johor.",Starbucks,johor-bahru,4.4,2099
4294,16119,"Sales Gallery, Lot PTB 22056, Danga Bay, Jalan Skudai, 80200 Johor Bahru, Johor",Starbucks,johor-bahru,4.4,329
4295,16120,"Lot S1, Ground Floor, PTD 220529, Persiaran Seri Alam, Bandar Seri Alam, 81750 Masai, Johor Bahru",Starbucks,johor-bahru,4.4,190
4296,15710,"MB-02c B1 Zone A, Jalan Wong Ah Fook, 80000 Johor Bahru",Bao Zhan,johor-bahru,4.6,265
4297,15707,"No. 125, Jalan Austin Heights 3, Taman Mount Austin, 81100 Johor Bahru",Bao Zhan,johor-bahru,4.6,373
4298,15705,"No. 11, Jalan Bestari 12/2, Taman Nusa Bestari, 81300 Skudai, Johor",Bao Zhan,johor-bahru,4.6,502
4299,15706,"No. 36, Jalan Sutera, Taman Sentosa, 80150 Johor Bahru",Bao Zhan,johor-bahru,4.6,376
4300,15709,"LG-52, 33, Jalan Seladang, Taman Abad, 80250 Jb",Bao Zhan,johor-bahru,4.6,316
4301,15708,"No. 35, Jalan Molek 1/5A, Taman Molek, 81100 JB",Bao Zhan,johor-bahru,4.6,538
4302,15712,"Lot No.L1-077/613, Level 1, Sutera Mall",Bao Zhan,johor-bahru,4.6,815
4303,15711,"UG-23 Floor UG, Paradigm JB, Jalan Mewah Ria 2, Taman Buit Mewah, 81200 JB",Bao Zhan,johor-bahru,4.6,743
4304,16681,"NO.3-01,JALAN AUSTIN HEIGHTS 8/3,  TAMAN MOUNT AUSTIN,  81100 JOHOR BAHRU,JOHOR.",My Art Studio,johor-bahru,4.7,0
4305,16695,"NO 7A,JALAN IMPIAN EMAS 5/6,  TAMAN IMPIAN EMAS,81300  SKUDAI,JOHOR",My Art Studio,johor-bahru,4.7,0
4306,16787,"Johor Bahru City Square, Level 4 Jalan Wong Ah Fook, Bandar Johor Bahru, 80000 Johor Bahru, Johor, Malaysia",Doi Chaang,johor-bahru,4.7,77
4307,16788,"G-11, Holiday Villa Johor Bahru, 260, Jalan Dato' Sulaiman, Taman Abad, Johor Bahru 80250",Doi Chaang,johor-bahru,4.7,193
4308,16783,"LG-07 Puteri Harbour, Persiaran Puteri Selatan, Puteri Harbour, Iskandar Puteri Harbour, 79000 Johor Bahru, Johor.",7 Grapes,johor-bahru,4.4,94
4309,16775,"49, Jalan Wong Ah Fook, 80000 Johor Bahru, Johor, Malaysia",Baguss City Hotel,johor-bahru,0,0
4310,16689,"NO.59B JALAN SUTERA TANJUNG 8/2,  TAMAN SUTERA UTAMA,  81300 SKUDAI,JOHOR.",My Art Studio,johor-bahru,4.7,0
4311,15618,"AEON Mall Tebrau City Lot F10 & F11, First Floor, 1, Jalan Desa Tebrau, Taman Desa Tebrau, 81100 Johor Bahru , MY",XIXILI,johor-bahru,4.7,3353
