id,merchant_id,address,name,city,rating,fave_paycnt
3446,14908,"51, Jalan GP 5, Taman Gadong Perdana, 75200 Melaka, Malaysia",H & H Guest House,malacca,0,0
3447,14467,"15, Jalan Kampong Kuli, 75200 Melaka, Malaysia ",Ohana House @15 Kuli,malacca,0,0
3448,14466,"53, Jalan Hang Kasturi, 75200 Melaka, Malaysia",Ohana House @53 Kasturi,malacca,0,0
3449,12136,"No.3, Jalan S.E. 1, Taman Semabok Emas, Taman Semabok, 75050 Malacca",Hotel Suria Malaqa,malacca,0,0
3450,12500,"28, Jalan KSB 12, Taman Kota Syahbandar, 75200, Malacca, Malaysia",Morganfield's,malacca,4.3,32
3451,12396,"Timez Hotel Melaka, 31 Jalan Hang Kasturi, Jonker Street, 75200 Melaka",SupperRabbit Cafe,malacca,4,0
3452,21376,"11-R, Jalan Tun Perak, 75350 Melaka",Massive Aesthetics,malacca,0,0
3453,21741,"Lot L45, Ground Floor, Tesco Melaka, No. 1, Jalan Tun Abdul Razak, 75400 Peringgit, Melaka",Starbucks,malacca,4.4,0
3454,21735,"Lot No. G17/EG2, No.1, Jalan Merdeka, Taman Costa Mahkota, 75000 Melaka",Starbucks,malacca,4.4,0
3455,21737,"Lot G89 & G90, AEON Bandaraya Melaka Shopping Centre, No. 2, Jalan Legenda, Taman 1-Lagenda, 75400 Melaka.",Starbucks,malacca,4.4,0
3456,21740,"Bangunan Starbucks Coffee, Jalan Kristal, Taman Limbongan Indah, 75200 Melaka",Starbucks,malacca,4.4,0
3457,21736,"BX-001A & G-003A, Dataran Pahlawan Melaka Megamall, Jalan Merdeka, Bandar Hilir, 75000 Melaka",Starbucks,malacca,4.4,0
3458,21739,"GF-10, The Shore Shopping Gallery, Jalan Persiaran Bunga Raya, Kampung Bunga Raya Pantai, 75100 Melaka",Starbucks,malacca,4.4,0
3459,22006,"Hatten Place Melaka, Jalan Melaka Raya 23, Hatten City, 75000 Melaka, Malaysia",Hatten Place Melaka (About Travel),malacca,0,0
3460,21263,"32, Ground Floor, Jalan PB 1A, Taman Puncak Bertam, 75260, Melaka.",Floor Depot,malacca,4.5,5
3461,21270,"32, Ground Floor, 
Jalan PB 1A, Taman Puncak Bertam, 
75260, Melaka.",Floor Depot,malacca,4.5,0
3462,21382,"no 20-1 jalan KSB 13 taman kota syahbandar, 75200 Melaka, Malaysia",W Crystal Beauty,malacca,5,0
3463,23010,"41, Lorong Hang Jebat, 75200 Melaka, Malaysia",林记鸡粒饭 Restoran Lim Jit,malacca,4.5,49
3464,23014,"100, Jalan Kampung Pantai, 75200 Melaka",Relish The Moment,malacca,4.6,127
3465,23173,"AEON Mall Bandaraya Melaka,No 2. Jalan Legenda Taman I-Legenda, 75400 Melaka",Cosas United,malacca,4.7,22
3466,23245,"15 & 17, Jalan Hang Jebat, 75200 Melaka, Malaysia",Jonker Street Chicken Rice Ball,malacca,0,2
3467,23199,"15, Jalan Tun Tan Cheng Lock, Taman Kota Laksamana, 75200 Melaka, Malaysia",Akusukakopi,malacca,5,26
3468,23198,"Unit 16, freeport A'Famosa Outlet, Jalan Kamus, 78000, Alor Gajah, Melaka, Malaysia.",VOIR GALLERY,malacca,4.5,0
3469,23329,"12A, Jalan KLJ 1A,Taman Kota Laksamana Jaya 75200 Melaka",Perfectice,malacca,4.8,46
3470,23330,"31, Jalan Hang Kasturi, 75200 Melaka, Malaysia",Superrabbit Cafe (Jonker Street),malacca,0,0
3471,23332,"15 Jalan Hang Lekir, 75200 Melaka, Malaysia",Our Kitchen,malacca,4.3,117
3472,4108,"AEON Bandaraya Shopping Centre Lot F06, No 2 Jalan Lagenda Taman 1-Lagenda Melaka 75400",Cres Wellness,malacca,4.4,0
3473,4884,"No.76, Jalan Lagenda 5, Taman 1-Lagenda Melaka 75400",Huayi Hair Care,malacca,0,0
3474,5832,"62&62-1, Jln Berkat 2, Tmn Malim Jaya Melaka 75200",Sun Cool Tinted Specialist Centre,malacca,4,0
3475,5884,"G19 Bayou Square, Jalan Wakaf Utama, Bukit Katil 75450",Magic Art Museum,malacca,4.1,0
3476,6042,"No. 100-1B, Lorong Haruan 5/4, Oakland Commerce Square Seremban 70300",Sense De Beauty Bodyline,malacca,3.8,0
3477,6096,G 14 Jalan Pm 9 plaza Mahkota Melaka 75000,VNS 18 Saloon,malacca,4.5,0
3478,6661,"16A-1, Jalan Berkat 5, Taman Malim Jaya, Melaka 75250",Yoga Hum Centre,malacca,2.5,0
3479,5723,"668-J,JLN BKT Melaka 1/3,TMN BKT Melaka, 75450 Melaka.",Diverse Beauty House,malacca,4.6,0
3480,6459,"165, Taman Melaka Raya 75000 Melaka",Pathlab,malacca,3.8,0
3481,6044,"No. 3, Tingkat Bawah, Medan Matrix, Jalan Manickavasagam, Seremban, Negeri Sembilan. 70200",Sense De Beauty Bodyline,malacca,3.8,0
3482,6043,"No. 45, Jalan Merdeka, Taman Melaka Raya, Melaka 75000",Sense De Beauty Bodyline,malacca,3.8,0
3483,6041,"No. 527-G, Jalan Bandar Senawang 16, Pusat Bandar Senawang, Seremban, Negeri Sembilan. 70450",Sense De Beauty Bodyline,malacca,3.8,0
3484,6045,"Shop A5, First Floor, 9 Avenue, Taman Koporat, Putra Nilai, Nilai, Negeri Sembilan. 71800",Sense De Beauty Bodyline,malacca,3.8,0
3485,6017,"No. 13 & 13-1, Jalan BPM 13, Taman Bukit Piatu Mutiara Malacca 75150",iSpa & Skin Therapy,malacca,4.4,0
3486,5705,"31, Grd Floor, Jln PPM8 , Plaza Pandan Malim Melaka 75250",Cadis Nail Art 彩甲坊,malacca,4.5,0
3487,5720,"No 23, Jalan CU 1, Taman Cheng Utama Malacca 75260",Jinho Health,malacca,1.5,0
3488,5710,"32 And 34, Jalan Inang 4, Taman Paya Rumput,Cheng Malacca 75250",Inory Kids Land,malacca,4.2,0
3489,5657,"17, Jalan Inang 2, Taman Rumput Utama, 76450 Melaka",Era Beauty House,malacca,3.6,0
3490,5661,"No.7, Jalan MH 3, Taman Muzaffar Heights, Ayer keroh Malacca 75450",De One Fitness,malacca,4.5,0
3491,21870,"Lot 2610, Mukim Bachang, Taman Malim Jaya, 75400 Melaka",Starbucks,malacca,4.4,0
3492,21892,"Lot F55, First Floor, AEON Bandaraya Melaka Shopping Centre
2, Jalan Legenda, Taman 1-Legenda, 75400 Melaka",Universal Traveller,malacca,4.6,44
3493,21893,"Lot G44, Ground Floor, Mahkota Parade
No.1, Jalan Merdeka, 75000 Melaka",Universal Traveller,malacca,4.6,136
3494,22127,"AEON Bandaraya Melaka Shopping Centre, 2, Jalan Lagenda, Taman 1 Lagenda, 75400 Melaka",Universal Traveller,malacca,4.6,17
3495,22120,"189, 9-G, Jalan Persisiran Bunga Raya, Kampung Bunga Raya Pantai, 75300 Melaka, Malaysia",Mio Boutique Hotel,malacca,0,0
3496,13107,"Pasteur Hyper Point, Ground Floor No. G 11 - G 14 Jl. Dr. Junjunan No. 126-128",A&W,bandung,0,0
3497,17480,Jl. Dr. Junjunan No. 126 – 128 Bandung 40162,A&W,bandung,0,0
3498,21824,"Jl. Peta No.241, Suka Asih, Bojongloa Kaler, Kota Bandung, Jawa Barat 40232, Indonesia",Churrobites Indonesia,bandung,4.5,0
3499,1151,Jl. Ir. H. Djuanda No. 90 Jawa Barat,The Palais Dago Hotel,bandung,0,0
3500,1079,"Jl. Cihampelas No.211-217, Cihampelas, Bandung 40131",Grand Tjokro Hotel Bandung,bandung,2.5,0
3501,978,"Best Western Premier La Grande, Jl. Merdeka No.25-29 Bandung - Jawa Barat 40117",Best Western Premier La Grande,bandung,2.5,0
3502,975,"Lembang, Jl. Kolonel Masturi Villa Istana Bunga Blok H1-3B, Lembang",Country Villa Lembang,bandung,0,0
3503,973,"Dago Pakar, Jl. Bukit Pakar Timur IV No.8, Cimenyan, Bandung - Jawa Barat",Dago Highland Resort & Spa,bandung,0,0
3504,992,"Jl. Sersan Bajuri No. 6, Sukasari, Bandung",Amoory Venice Guesthouse,bandung,0,0
3505,4555,"Jl. Sumatera no. 1, Bandung",Diva Karaoke Bandung,bandung,4.5,0
3506,4740,"Jl. Tubagus Ismail VIII No.45, Sekeloa, Coblong, Kota Bandung, Jawa Barat 40134",Lotus Hotel Bandung,bandung,0,0
3507,4744,"Jl. Setiabudhi No 191, Gegerkalong Sukasari, Kota Bandung, Jawa Barat",Banana Fitness Center,bandung,4.2,0
3508,4758,"Jl. Setiabudhi No. 191, Gegerkalong Sukasari, Kota Bandung, Jawa Barat.",Banana Spa,bandung,4.2,0
3509,5275,"Jalan Sukajadi No.131-139.Paris Van Jaba.Blok.RLD28.Lt.G, Cipedes, Sukajadi, Cipedes, Sukajadi, Kota Bandung, Jawa Barat 40162",First Love Patisserie,bandung,4.8,0
3510,5255,Jl. Mekar Utama no 111-L Komplek Mekar Wangi Bandung,Delanov Studio,bandung,4.7,0
3511,5761,Jl. Sultan Agung no 7,I- Cup Bubble Tea,bandung,4.4,0
3512,5762,Festival City Link Food Court 3rd Floor,I- Cup Bubble Tea,bandung,4.4,0
3513,5764,Bandung Trade Center 3rd Floor,I- Cup Bubble Tea,bandung,4.4,0
3514,5763,"Bandung Electronic Center, Food Court 3rd Floor",I- Cup Bubble Tea,bandung,4.4,0
3515,5797,Jl. Supratman No. 29 Bandung,Postcard Cafe & Co,bandung,0,0
3516,5792,"JL. Ir H Juanda No. 392-394 Dago, Bandung",Dago Keuken @The Silk Hotel,bandung,0,0
3517,5800,Mayfair Building Lantai 2 Jl Sukajadi 228,Monza Salon,bandung,4.4,0
3518,5798,Jln. Cihampelas No.12 Bandung,Poin Phila Hotel,bandung,0,0
3519,5749,"Jalan Prof. Eyckman 19-21 Pasteur, Sukajadi, Bandung",Andelir Hotel,bandung,0,0
3520,4032,Jl. Surapati No. 49 (Area RM. Sunda Bale Gazebo) Bandung,Fasdel,bandung,4.1,0
3521,3951,"Jl Pratista II Blok E64, Antapani 40291",Del's Make Up,bandung,0,0
3522,4037,"Taman Tengah, Jl Wira Angun-Angun no 22 Bandung",Mon Cherie,bandung,4.4,0
3523,4016,"Jl. Lodaya 16B, Burangrang Bandung",Bamboo Family Reflexology,bandung,4.3,0
3524,4522,"Jl. Jendral Gatot Subroto No.289, Cibangkong, Kec. Bandung, Kota Bandung, Jawa Barat 40273",Raffel's Sandwich,bandung,4.6,0
3525,4621,Jl. CIlaki No. 45 Bandung,Mister Komot,bandung,4.3,0
3526,4521,"Jl. Sukajadi No. 131 - 139, Cipedes, Sukajadi, Kota Bandung, Jawa Barat 40162",Raffel's Sandwich,bandung,4.6,0
3527,4523,"Jalan Pasirkaliki No.25-27, Paskal Hyper Square Blok D 62, Kb. Jeruk, Andir, Kota Bandung, Jawa Barat 40181",Raffel's Sandwich,bandung,4.6,0
3528,4524,"Jl. Parahyangan, Cipeundeuy, Padalarang, Kabupaten Bandung Barat, Jawa Barat 40553",Raffel's Sandwich,bandung,4.6,0
3529,4544,"Blooming Restaurant Grand Setiabudi Hotel. Jl. Setiabudi no. 130-134, Bandung",Blooming Restaurant @ Grand Setiabudi Hotel Bandung,bandung,3.3,0
3530,5646,"Jl. Ir. H.Djuanda, Citarum, Coblong",Mister Donuts,bandung,4.7,0
3531,5460,Jl. Karawitan No. 43 Bandung,Ayie Lie Salon & Hair Consultant,bandung,0,0
3532,5441,"Istana Pasteur Regency, Jl. Sukaraja Blok CRA No.11, Sukaraja, Cicendo, Kota Bandung, Jawa Barat 40175",dr Yanti Aesthetic Clinic Bandung,bandung,4.9,0
3533,3914,Jl. Wastu Kencana No. 48 Bandung,California Hotel Bandung,bandung,0,0
3534,4504,"Trans Studio Mall LT 2, Jalan Jendral Gatot Subroto No.289, Cibangkong, Batununggal, Kota Bandung, Jawa Barat 40273",Zahra Turkish Ice Cream,bandung,4.2,0
3535,4505,"Paris Van Java, Glamour Level, Jl. Sukajadi No. 131 - 139, Cipedes, Sukajadi, Kota Bandung, Jawa Barat 40162",Zahra Turkish Ice Cream,bandung,4.2,0
3536,4526,"Jl Cihampelas no.211 RT 6 RW 2 Kel. Cipaganti Kec. Coblong, Kota Bandung Jawa Barat",TSPA by Grand Tjokro Hotel,bandung,4.3,0
3537,4488,"Bandung Indah Plaza Ground Floor, Jl. Merdeka No.56, Citarum, Bandung Wetan Bandung - Jawa Barat",Rice Bowl,bandung,4.4,0
3538,5177,"Jl. Pada Emut - Cigupakan RT 01 RW 03 Desa Cilengkrang, Ujung Berung Bandung",Puri Cigupakan,bandung,4.5,0
3539,5184,"Jl. Neglasari no 11, Ciumbuleuit Bandung",I am Ocha,bandung,0,0
3540,5247,Jl. Cihampelas No. 171,Amaris Cihampelas,bandung,0,0
3541,5240,"Jl. Batununggal Jelita II No.63 Mengger, Bandung Kidul, Bandung",Tahu Susu Papa,bandung,0,0
3542,5241,"Jalan Batununggal Jelita 2, No 63",Pasta Mama,bandung,0,0
3543,5244,"Jl. Cihampelas no. 171, Bandung",Xpress Restaurant at Amaris Cihampelas,bandung,2,0
3544,5236,Jl. Mekar Utama No. 40. Komplek Mekar Wangi Bandung,Alexa d’Fabian Salon,bandung,3.9,0
3545,5219,Jl. Colonel Masturi Kampung Kramat no. 1,Bantal Guling Villa Lembang,bandung,0,0
3546,5223,"Jl. Moh. Toha No. 42, Bandung, Jawa Barat, Indonesia",Bantal Guling Villa Alun Alun,bandung,0,0
3547,5729,Jl. Dipatiukur No.72-74 Bandung,Neo Hotel Dipatiukur,bandung,4.1,0
3548,5739,Jl. Prof Eyckman 19 Bandung,Narwastu Restaurant,bandung,0,0
3549,5686,"Jl. Indraprahasta Timur No. 15 Komp. Singgasana Pradana, Kota bandung",Clean & Revive Shoe Laundry,bandung,4.7,0
3550,4419,"Jalan Dago Pakar Permai I No. 25, Mekarsaluyu, Cimenyan, Bandung, Jawa Barat 40198",Lotus Hotel Bandung,bandung,0,0
3551,4432,Jl. Gatot Subroto No. 163 Bandung,Poise & Polish,bandung,4.7,0
3552,4391,"Jl Hortikultura No. 88, Lembang - Bandung",San Gria Resort & Spa,bandung,5,0
3553,5155,"Jalan Terusan Jakarta No.316, Komplek Puri Dago, Antapani, Sukamiskin, Arcamanik, Kota Bandung, Jawa Barat 40291",Puri Barbershop & Salon,bandung,4.3,0
3554,4939,"Jalan Terusan Professor Doktor Sutami Kav. 1B, Sarijadi, Sukasari, Sarijadi, Sukasari, Kota Bandung, Jawa Barat 40151",SLVR International Clinic Bandung,bandung,4.5,0
3555,5170,"Jl. Garuda No.63, Dungus Cariang, Andir, Kota Bandung, Jawa Barat 40184",West Point Hotel,bandung,4,0
3556,4070,"Jl. Lekong Kecil 73C, Bandung",The Queen FeyFey Hair Studio,bandung,3.8,0
3557,4765,"Jalan Cihampelas No. 160, Cipaganti, Coblong, Kota Bandung, Jawa Barat",Platinum Resto & Café,bandung,4.7,0
3558,4794,"Cihampelas Walk, Jl. Cihampelas No.160, Cipaganti, Coblong, Kota Bandung, Jawa Barat 40131",Baso Malang Karapitan,bandung,4.6,0
3559,4793,"Jl. Merdeka No. 21, Babakan Ciamis, Sumur Bandung, Kota Bandung, Jawa Barat 40117",Baso Malang Karapitan,bandung,4.6,0
3560,4848,"Jl. Sumatera no. 19, Bandung",Indischetafel,bandung,4.5,0
3561,4936,Komp. Istana Mekar Wangi. Jl Mekar Utama Raya No. 93 B Bandung,Beauty Smile Dental Clinic,bandung,4.8,0
3562,5819,"Jl. Naripan no 38, Bandung",Everyday Spa,bandung,4.7,0
3563,5818,Jl. Aceh no 66 RT 005 / 006. Merdeka Sumur Bandung,Everyday Spa,bandung,4.7,0
3564,5820,"Jl. Surya Sumantri no. 116, Bandung",Everyday Spa,bandung,4.7,0
3565,5810,Jl. Raya Tangkuban Perahu KM 16-17,Puteri Gunung Hotel Cottage,bandung,0,0
3566,5805,Jl Awiligar Raya 2 No 2 Bandung,Verbena Cafe at Clove Garden Hotel,bandung,4.3,0
3567,9210,"Jl. Aceh No. 71 A, Citarum, Bandung Wetan, Citarum, Bandung Wetan, Kota Bandung, Jawa Barat 40115",The Roses @ Amaroossa Hotel Bandung,bandung,4.6,0
3568,9417,"Jl. R.A.A. Marta Negara No.40, Lkr. Sel., Lengkong, Kota Bandung, Jawa Barat 40264",Omah Kretek,bandung,4.2,0
3672,25752," 309, Jln pusat dagangan sendayan 3/6, 71950 Sendayan Village",Where Dev Meets John - WDMJ,seremban,4,2
3569,9422,"Jl. Sukajadi 131-139, PVJ Concourse Level (Carrefour Level), Cipedes,
Sukajadi, Bandung City, West Java 40162 Telp 0813-1141-2502",CREMERIA DI DEE,bandung,4.7,0
3570,9394," Istana Plaza lt 2 SF-7 - Jl. Pasirkaliki No.125, Pamoyanan, Cicendo, Kota Bandung, Jawa Barat 40173",Blackball,bandung,4,4
3571,9483,"Jalan Raya Lembang No.234 (Gudang Kahuripan) Lembang, Indonesia",Rumah Halloween Bandung,bandung,5,0
3572,9414,"Unit B 203, Jl. Gatot Subroto no 289, Cibangkong, Kec. Bandung, Kota Bandung, Jawa Barat",Pepper Lunch Bandung,bandung,4.8,0
3573,9413,"Blok RL-A-08, Jl Sukajadi no 137 – 139, Cipedes, Sukajadi",Pepper Lunch Bandung,bandung,4.8,0
3574,9431,"Taman Kopo Indah III. Ruko D22. Kel. Rahayu Kec. Margaasih, Bandung",Lok Thian Resto,bandung,4.7,0
3575,9416,"#L2-25-26, Jalan Pasir Kaliki, No 25-27, Kebeon Jeruk, Andir, Bandung",Pepper Lunch Bandung,bandung,4.8,0
3576,9415,"Plaza, L3 Unit TF-CR-1, Jl. Pasir Kaliki no 121-123, Pamoyanan, Cicendo, Kota Bandung",Pepper Lunch Bandung,bandung,4.8,0
3577,9432,Jl. Sukahaji no. 111. Bandung. Setiabudi. Bandung (Sebelah bengkel motor),Totti Pizza,bandung,4.8,0
3578,9634,"Jl. Somawinata 17 Café Marbel, Cidahu, Cimahi, West Java, Indonesia",Waroenk Pizza,bandung,4.5,0
3579,9633,"Jln Anggrek B3, Rancaekek, Bandung, West Java, Indonesia (depan stasiun kencana)",Waroenk Pizza,bandung,4.5,0
3580,9635,"Jl. Mohammad Toha (Perbas) Terusan Cibiuk Dalam, Bandung",Waroenk Pizza,bandung,4.5,0
3581,9579,"Jl. Candra Kirana, Cibaduyut, Bojongloa Kidul, Kota Bandung, Jawa Barat, Indonesia",Starbright Learning Centre,bandung,0,0
3582,9650, Jl. Sudirman no. 107 (Sudirman Street Day & Night Culinary),King Crab,bandung,4.3,0
3583,9685,"BATUNUNGGAL INDAH CLUB. Jl. Batununggal Indah IX No.2, Kec. Bandung Kidul, Jawa Barat",Brazilian Soccer Schools Bandung,bandung,0,0
3584,9655,"Bikasoga Futsal Jalan Suryalaya Indah No. 1-3, Cijagra, Lengkong, Cijagra, Lengkong, Kota Bandung, Jawa Barat 40265",Brazilian Soccer Schools Bandung,bandung,0,0
3585,9651,Buah Batu Centrum Ruko C no. 10. Jln Raya Bojongsoang (depan SDN Bojongsoang 1),King Crab,bandung,4.3,0
3586,9654, Jl. Anggrek no 55. Stop & Shop (Depan Taman Superhero),Whyribs,bandung,4.6,0
3587,8632,"Jl. Raya Sindanglaya no. 327, Bandung",Klub Tamansari,bandung,4.3,0
3588,8534,"Gallery Ciumbuleuit 2, Jl. Ciumbuleuit No 56 A, Lantai Ground Apartment",Svarga Emotion Sanctuary,bandung,4.4,0
3589,9748,"Jalan Pasirkaliki No.25-27, Kb. Jeruk, Andir, Paskal Hyper Square Blok D No.11, Jawa Barat 40171",Sukha Delights,bandung,4.3,0
3590,8707,"Jalan Terusan Sersan Bajuri No. 45 Cihideung, Lembang - Bandung",Jadul Village Resort and Spa Bandung,bandung,0,0
3591,8700,"Jl. L. L. R.E. Martadinata No.83, Citarum, Bandung Wetan, Kota Bandung, Jawa Barat 40115, Indonesia",Martabak AH!,bandung,4.4,0
3592,9108,"Jalan Terusan Sersan Bajuri No.45, Cihideung, Parongpong, Cihideung, Parongpong, Kabupaten Bandung Barat, Jawa Barat 40559",Jadul Spa @ Jadul Village Resort and Spa,bandung,2.8,0
3593,9110,"Jl Terusan Sersan Bajuri No. 45 Cihideung, parongpong, kabupaten bandung barat",Jadul Restaurant @ Jadul Village Resort and Spa,bandung,5,0
3594,9068,"Jl. Setiabudhi No. 49-51 (satu area dengan Yoshinoya, Seorae, dan Macademia)",Lets Go Gelato,bandung,4.8,0
3595,9067,"Jl. Bengawan No.29, Cihapit, Bandung Wetan, Kota Bandung, Jawa Barat 40114",Lets Go Gelato,bandung,4.8,0
3596,9070,Jl. Ciumbuleuit (yogya Ciumbuleuit),Lets Go Gelato,bandung,4.8,0
3597,9069,"Cihampelas Walk Mall, Ciwalk Extension Lt. 1 (Skywalk Area, dekat English First)",Lets Go Gelato,bandung,4.8,0
3598,9129,"Jl. Ciumbuleuit No.147, Hegarmanah, Cidadap, Kota Bandung, Jawa Barat 40141",Lets Go Gelato,bandung,4.8,0
3599,9093,Jalan Kesatriaan Gang Saleh No. 10 Bandung,Elizabeth Lisa MUA,bandung,5,0
3600,9127,"Jl. Ir. H. Djuanda, No. 157, Dago, Bandung",Amarantha Fluerist,bandung,5,0
3601,9207,"Harris Convention Hotel, Jl Ciumbuleuit 50 - 58 Bandung",Svarga Emotion Sanctuary,bandung,4.4,0
3602,9190,"Jl. Sukajadi No. 131 - 139, Cipedes, Sukajadi, Cipedes, Sukajadi, Kota Bandung, Jawa Barat 40162",Ixobox ,bandung,4.6,0
3603,9189,"Jalan Pasirkaliki No.25-27, Kebon Jeruk, Andir, Kb. Jeruk, Andir, Kota Bandung, Jawa Barat 40181",Ixobox ,bandung,4.6,0
3604,9157,"Jl. H. Wasid No.31(dipatiukur), Kota Bandung, Jawa Barat, Lebakgede, Coblong, Lebakgede, Coblong, Kota Bandung, Jawa Barat 40132",Upside Down World Bandung,bandung,4.6,0
3605,9143,Paskal Hypersquare Ruko B-70. Jalan Pasirkaliki. Bandung,Gogijib Korean BBQ,bandung,4.7,0
3606,9208,JL. WR . SUPRATMAN NO. 98 BANDUNG (Lobby Area),Svarga Emotion Sanctuary,bandung,4.4,0
3607,9274,Jl. Katamso no. 45. Bandung (Sebelah JNE),Magma Plate,bandung,4.4,0
3608,9275,"Jl. Rancabentang No.2c, Ciumbuleuit, Cidadap, Kota Bandung, Jawa Barat 40141",CREMERIA DI DEE,bandung,4.7,0
3609,9320,Komp D’Casa Grande no. 46. Jl. Cisaranten Kulon,Putrireyna MUA,bandung,4.8,0
3610,9324,"Jl Sukajadi, Bandung",Fukuzushi Bahureksa,bandung,4.3,0
3611,9334,"Apartemen Galeri Ciumbeluit II Lantai G Jl. Ciumbeluit no. 56
",Svarga Emotion Sanctuary,bandung,4.4,0
3612,9325,"jl Sukajadi, Bandung",Atizuto,bandung,3.9,0
3613,9318,"Jl. Taman Kopo Indah 2, Rahayu, Margaasih, Bandung, Jawa Barat 40218 (Sebelah griya TIKI)",D'BITE Cafe,bandung,4.6,0
3614,9328,"Jl. Mekar Pratama 3B (Mekar Wangi), Bandung",Svarga Emotion Sanctuary,bandung,4.4,0
3615,9273,"Istana Holis Regency No. C11, Bandung Kulon, Babakan, Bandung, Kota Bandung, Jawa Barat 40212",House of Tofi,bandung,4.9,0
3616,9350,Jln Sekelimus Tengah no 36,Cizprek,bandung,3.5,0
3617,9351,Jln Sekelimus Tengah no 36,Kerang Ajaib,bandung,5,0
3618,7078,"Jalan Ir. H. Djuanda No. 106 Lebak Siliwangi, Coblong, Lebakgede, COblong, Kota Bandung, Jawa Barat 40132",L'Societe Dine & Bar,bandung,4.2,0
3619,7527,"Jalan Dokter Setiabudhi No 49-51, Isola, Sukajadi, Pasteur, Sukajadi, Bandung",Seorae Bandung,bandung,4.8,0
3620,8959,"Jalan Taman Cempaka No.7, Taman Foto, Bandung City, West Java 40113",Mg & Co Eatery,bandung,4.4,0
3621,8964,"Jl. Dipatiukur, No. 1, Bandung",Reds Dipo,bandung,4.4,0
3622,8881,"Jl. Merdeka No. 49.Citarum, Bandung Wetan, Babakan Ciamis, Sumur Bandung, Kota Bandung, Jawa Barat 40117",Seruni Photo,bandung,5,0
3623,8909,"Ruko Istana Pasteur, Jalan Sukaraja CRB 99 Gunung Batu",Joanne Studio,bandung,4.8,0
3624,8944,"Jl Dago Pakar Permai I No.8 KVII6 RT.001 RW.007 Mekar Saluyu, Cimenyan Kab Bandung",Tian Jing Lou @ InterContinental Bandung Dago Pakar,bandung,4.6,0
3625,8945,"Jalan Dago Pakar Permai I No. 8 KVII6 RT.001 RW.007 Mekar Saluyu,Cimenyan Kab. Bandung",Deli8 @ InterContinental Bandung,bandung,4.7,0
3626,8730,"Jl. L. L. R.E. Martadinata No.207, Cihapit, Bandung Wetan, Kota Bandung, Jawa Barat 40115, Indonesia",Grand Tebu Hotel,bandung,0,0
3627,8793,"Jl. Citarum, No. 12, Riau, Bandung",Glosis,bandung,4.6,0
3628,8943,"Jl Dago Pakar Permai I No.8 KVII6 RT.001 RW.007 Mekar Saluyu, Cimenyan Kab Bandung",Damai Restaurant @ InterContinental Bandung Dago Pakar,bandung,4.8,0
3629,9011,"Jl Batununggal Indah IV No 65 Mengger, Bandung Kidul, Bandung",The President – School of Leadership,bandung,0,0
3630,8633,"Jl. Burangrang No.3, Malabar, Lengkong, Kota Bandung, Jawa Barat, 40262, Indonesia",GOGI Korean BBQ,bandung,4.6,0
3631,8664,"Jalan otto Iskandardinata No. 460, Nyengseret, Astanaanyar, Kota Bandung, Jawa Barat 40242",Swimming Pool at D'Best Hotel Pasar Baru,bandung,4.3,0
3632,9786,"Jl. Sukajadi No. 131 - 139, Cipedes, Sukajadi, Cipedes, Sukajadi, Kota Bandung (DEPAN CARREFOUR)",Think Thai @ PVJ Bandung,bandung,4.6,0
3633,9801, Jl Cihampelas no 211 - 217,Grand Tjokro Restaurant,bandung,0,0
3634,9778,"Jalan Pasirkaliki No.25-27, Kb. Jeruk, Andir, Paskal Hyper Square Blok C No.10, Jawa Barat 40171",D'Indsomnia Cafe,bandung,5,0
3635,9962,"JL. Lengkong Kecil No. 76-80, Paledang, Lengkong, Kota Bandung, Jawa Barat 40261",De'Rain Hotel,bandung,0,0
3636,9966,"Jl. Garuda No.39, Garuda, Andir, Kota Bandung, Jawa Barat 40184",Spot Eat and Drink,bandung,4.4,0
3637,9975,"Jl. Babakan Jeruk III No.37-39, Sukagalih, Sukajadi, Kota Bandung, Jawa Barat 40163",Hotel Ilos,bandung,0,0
3638,9916,"Paskal Hypersquare B69, Jalan Pasirkaliki, Kb. Jeruk, Kota Bandung, Jawa Barat 40181",56 Degrees,bandung,4,0
3639,10061,"Crowne Plaza, Jl. Lembong No.19, Braga, Sumur Bandung, Kota Bandung, Jawa Barat 40111",Infinite Resto and Lounge,bandung,4.4,0
3640,7710,"2f, Jusco Seremban 2 Shopping Centre, Negeri Sembilan.",Red Box Karaoke Group,seremban,4.4,488
3641,6659,"142, Bukit Pelandok 71960 Port Dickson",Goh Pay Yong Enterprise Dried Meat,seremban,2.7,0
3642,6638,"3.5 Km Jalan Pantai, Kampung Si Rusa Port Dickson 71000",Corus Paradise Resort,seremban,0,0
3643,12904,"4-G-21, Persiaran Waterfront, PD Waterfront, 71000 Port Dickson, Negeri Sembilan",Waterfront Boutique Hotel,seremban,0,0
3644,11287,"Batu 2, Jalan Seremban, Negeri Sembilan, Lukut Port Dickson 71000",Lexis Port Dickson,seremban,0,0
3645,11282,"Batu 2, Jalan Seremban, Negeri Sembilan, Lukut Port Dickson 71000",Grand Lexis Port Dickson,seremban,0,0
3646,15307,"D - L1 - 6, Paradise Lagoon Apartment, 3 1/2 KM, Jalan Pantai, Port Dickson, Negeri Sembilan, Malaysia, 71000",Paradise Lagoon Apartment,seremban,0,0
3647,15318,"Lot 745, Batu 8, Jalan Pantai, 71050 Port Dickson, Negeri Sembilan, Malaysia",Seri Bulan Condominium,seremban,0,0
3648,16692,"No.186-1, Jalan S2 B22, Pusat Dagangan Seremban 2, 70300 Seremban, Negeri Sembilan",My Art Studio,seremban,4.7,0
3649,14770,"Sehat Wellness & Medical Centre, 3rd Floor, 352, Jalan S2 B9,Uptown Avenue Seremban 2, 70300 Seremban, Negeri Sembilan, Malaysia",3D Feet,seremban,4.3,0
3650,9433,"Admiral Marina & Leisure Club, 51Ž2 Miles, Jalan Pantai, 71050 Si Rusa, Negeri Sembilan, Malaysia.",Platinum Charters,seremban,4.3,0
3651,16370,"Lot Np. GK-12, 12A & 13, Ground Floor Level, Mydin 2, Lot 31156, Jalan S2 B7, Seremban 2, 70300 Seremban, Negeri Sembilan",A&W,seremban,4.2,0
3652,26052,"201, Jalan S2 B14, Seremban 2, 70300 Seremban, Negeri Sembilan, Malaysia",Narayana Tea Stall,seremban,4.7,497
3653,26747,"10 Jalan Prima 4, Lukut Prima 71010 Port Dickson",Alyse Cafe,seremban,4.5,146
3654,26024,"G27, Mesa Mall, Persiaran Ilmu, Bandar Baru Nilai, 71800 Nilai, Negeri Sembilan",HARUMi,seremban,4.6,120
3655,26392,"48, Jalan Mahajaya, Kampung Bahasa Kapor, 71000 Port Dickson, Negeri Sembilan, Malaysia",Legato Floral Cafe,seremban,4.6,156
3656,26372,"No.K-05, UG Floor, Palm Mall, Seremban, Jalan Sungai Ujong, 70200 Seremban Negeri Sembilan.",LAZO DIAMOND,seremban,3.5,0
3657,27884,"164-1 & 165-1, Jalan S2 B22, Pusat Dagangan Seremban 2, 70300, Seremban, Negeri Sembilan
",VI FITNESS Seremban,seremban,4.8,89
3658,27918,"258, Jalan S2 B12, Uptown Avenue, Seremban 2, 70300 Seremban",EstherBelle Skin & Body Care,seremban,5,0
3659,24181,"75, Jalan S2 F2, Garden Homes, 70300 Seremban, Negeri Sembilan, Malaysia",Seremban Toast House,seremban,4.7,203
3660,24218,"227, Jalan S2 B10, Seremban 2, 70300 Seremban, Negeri Sembilan, Malaysia",One Billion Restaurant,seremban,4.5,277
3661,24205,"348, Jalan S2 B8, Uptown Avenue, 70300 Seremban 2, Negeri Sembilan",Miracle Physiotherapy Rehabilitation And Pain Clinic,seremban,5,0
3662,24221,"235 Jalan S2 B10, Uptown Avenue, Seremban 2 70300 Negeri Sembilan",ShabuZEN,seremban,4.4,88
3663,24222,"283 Jalan S2 B13, Uptown Avenue, 70300 Seremban, Negeri Sembilan",The Beast Cafe,seremban,4.8,129
3664,24213,"86, Jalan MPK 2 Kepayang Commerce Square 70200 Seremban, Negeri Sembilan",Seremban HK Noodle House,seremban,4.5,198
3665,24520,G-35 Aeon Mall Nilai,Melonpan Ice,seremban,4.5,71
3666,24445,"Mydin Hypermarket Seremban 2, S-13 Second Floor, Persiaran S2 B7 Ground Floor, Seremban 2, 70300 Seremban, Negeri Sembilan",Eagle J Tech,seremban,0,2
3667,24484,"9-L1 Seremban Gateway, Off Jalan Sungai Ujong Seremban, 70200 Negeri Sembilan",The Muffin House Veggie Cafe,seremban,4.2,286
3668,24425,"116, Jln S2 B20, Seremban 2, 70300 Seremban, Negeri Sembilan, Malaysia",The Urban Affairs,seremban,4.9,83
3669,24390,"Lot LG no2, Palmmall shopping centre, kemayan square, Jalan Sungai Ujong 70300 seremban. Negeri Sembilan ",BBQ Chicken,seremban,4.1,0
3670,24560,"15&16 Jalan Cattleya 11, Pusat Perniagaan Senawang Jaya 2 70450 Senawang, Seremban",Nanyang Kopitiam,seremban,4.3,339
3671,25981,"5-1, Jalan bukit galena 1, Taman Bukit Gelena, 70200, Seremban",Skill Termite Exterminator,seremban,0,0
3673,26394,"338, Jalan S2 B8, Seremban 2, 70300 Seremban, Negeri Sembilan, Malaysia",Legato Floral Design,seremban,4.8,58
3674,26393,"Wisma Gaya, 3a, Taman Putera, Batu 1 Jalan Seremban, 71000 Port Dickson",Legato Floral Design,seremban,4.8,4
