id,merchant_id,address,name,city,rating,fave_paycnt
4729,16696,"1ST FLOOR, LOT 72, MDLD 8955, D'PERDANA SQUARE,  PHASE 5, BANDAR SRI PERDANA, KM 4, JALAN SILAM,  91100 LAHAD DATU, SABAH",My Art Studio,kota-kinabalu,4.7,0
4730,16698,"Lot 29 , ground floor,block c , lintas square , 88300 kk sabah",Crown Bakery,kota-kinabalu,4.4,1086
4731,16679,"NO.10-1,LOT 26,1ST FLOOR,  LORONG LINTAS PLAZA 4,  LINTAS PLAZA,KOTA KINABALU.",My Art Studio,kota-kinabalu,4.7,0
4732,16828,"Level 2 City Mall, Jalan Lintas, 88300 Kota Kinabalu, Sabah",Haymart,kota-kinabalu,4.2,24
4733,16827,"NO. A-0-06 & A-0-07, GROUND FLOOR, BLOCK A, WARISAN SQUARE (2.89 km) Kota Kinabalu",Haymart,kota-kinabalu,4.2,3
4734,16876,"Lot 1 & 2, 1st Floor, Block E, LRG Komersil 88/2, 88 Market Place, Jalan Pintas, 88300 Kota Kinabalu, Sabah.",极品养生锅 Primo Hotpot,kota-kinabalu,4.6,222
4735,14773,"Block E, Ground Floor, Lot 3, Lorong Pusat Komersil 88/2, 88 Marketplace (Pusat Komersil 88), Kota Kinabalu ",Check In Dining,kota-kinabalu,4.5,542
4736,14751," Plaza Shell, G08, Jalan Tunku Abdul Rahman, 88000 Kota Kinabalu, Sabah",Pregio Cafe,kota-kinabalu,4.8,0
4737,14750,"Lot No 17, Lorong Kompleks Bsa , Kompleks Bsa, 88450, Kota Kinabalu, Sabah.",Pregio Cafe,kota-kinabalu,4.8,916
4738,14806,"No. 37 Ground Floor, Jalan Pantai, 88000 Kota Kinabalu, Sabah.",Gaya Coconut Shake,kota-kinabalu,4.5,67
4739,14454,"Kiosk no.M-0-CCK4，Ground floor,citymall,jalan lintas,kota kinabalu,sabah",Lucky Bean,kota-kinabalu,4.7,659
4740,14453,"Block E, 16-0 Lintas Square, Jalan Lintas, Kota Kinabalu, Sabah, Malaysia. 88300",Lucky Bean,kota-kinabalu,4.7,2589
4741,14455,"Unit No. K5, Basement, Imago Shopping Mall",Lucky Bean,kota-kinabalu,4.7,766
4742,14456,No.88 Ground Floor jalan gaya kota kinabalu 88000,Lucky Bean,kota-kinabalu,4.7,146
4743,14452," Lot 2, Ground Floor, Block I, Lintas Jaya Uptownship, 88200, Kota Kinabalu, Sabah.",Tree Monk,kota-kinabalu,4.8,881
4744,15350,"Car Park 4th Floor, Jalan Tun Fuad Stephens, Pusat Bandar Kota Kinabalu, 88000 Kota Kinabalu, Sabah",Cars International,kota-kinabalu,4,0
4745,15352,"Level 2, One Borneo Mall, 88400 Kota Kinabalu, Sabah",Cars International,kota-kinabalu,4,0
4746,15384,"Jalan Kompleks Sukan Ranau, 89308 Ranau, Sabah, Malaysia",AirVenture Paragliders,kota-kinabalu,0,0
4747,15396,"Lot 10, No. 39 Teck Guan Villa, Lorong Tupai, Mile 3, Jalan Penampang, 88300 Kota Kinabalu",I DEGREE,kota-kinabalu,4.2,344
4748,9476,"Lot G 1-1, Block G, 1st Floor, Metro Town, 88300 Kota Kinabalu, Sabah",Coco De Beauty,kota-kinabalu,4.6,0
4749,16610,"BLOCK G,UNIT 59-2,PLAZA 333,  KOBUSAK COMMERCIAL CENTRE,  89500, KOTA KINABALU SABAH.",My Craft Studio,kota-kinabalu,4.8,0
4750,13891,"B21, Imago Shopping Mall, KK Times Square PH 2, Jalan Coastal Highway, 88100, Kota Kinabalu, Sabah.",Sticky,kota-kinabalu,4.5,0
4751,12821,"Lot 21, Lorong Industri Warisan 2, Taman Industri Warisan Indah, Batu 7, Jalan Tuaran, Inanam 88450 Kota Kinabalu Sabah",LLumar Window Film,kota-kinabalu,5,0
4752,12778,"CL 015109672, Mile 2 1/2, Jalan Penampang 88902 Kota Kinabalu Sabah",LLumar Window Film,kota-kinabalu,5,0
4753,13805,"Lot 25, Tingkat 1, Kedai Plaza Grand Millennium, Jalan Penampang Bypass, Penampang, 88300 Kota Kinabalu, Sabah",Millennium Hair & Beauty Saloon,kota-kinabalu,4.7,0
4754,13782," Metro Town, Block L, Unit 3 & 4, 1st Floor, Jln Bunga Ulam Raja, 88300 Kota Kinabalu.",Bellzza Beauty & Wellness,kota-kinabalu,0,0
4755,26748," No 46, Ground Floor, Block E, Damai Plaza Phase 4 88300 Kota Kinabalu",Qooka,kota-kinabalu,4.8,95
4756,26385,"GROUND FLOOR, LOT  G- 702, 1 BORNEO HYPERMALL, JALAN SULAMAN, KOTA KINABALU, SABAH.",Perfec Time,kota-kinabalu,5,89
4757,26388,"Lot Part of 3-28 & 3-29, 3rd Floor, Suria Sabah Shopping Mall, Jalan Tun Fuad Stephen, 88000 Kota Kinabalu, Sabah",Kitaro Japanese Ramen,kota-kinabalu,4.6,183
4758,26101,"No. 10, Lot 10, Ground Floor, Kolam Centre 2, 88300, Kota Kinabalu, Sabah",Chieng Pork Shop (Sabah) Sdn Bhd 詹爸新鲜猪肉专卖,kota-kinabalu,4.6,271
4759,26103,"Unit No. 6 & 7, Block A, Taipan 28 Phase 1, KK Taipan, Jalan Kionsom Inanam Town, 88450, Kota Kinabalu, Sabah",Chieng Pork Shop (Sabah) Sdn Bhd 詹爸新鲜猪肉专卖,kota-kinabalu,4.6,143
4760,26354,"Kiosk B-A, Lower Ground Floor, Suria Sabah, 88300 Kota Kinabalu, Sabah, Malaysia.",LAZO DIAMOND,kota-kinabalu,3.5,1
4761,26355,"Lot P2 A & B, Ground Floor, Centre Point Sabah, No. 1, Jalan Centre Point, 88000 Kota Kinabalu, Sabah, Malaysia.",LAZO DIAMOND,kota-kinabalu,3.5,0
4762,26366,"M-0-29 (GA18), Ground Floor, City Mall, Jalan Lintas, Luyang, 88300 Kota Kinabalu, Sabah.",LAZO DIAMOND,kota-kinabalu,3.5,0
4763,27923,"GROUND FLOOR, KIOKS G-28, KARAMUSING COMPLEX, KOTA KINABALU SABAH.",Why,kota-kinabalu,4.8,44
4764,27922,"1st Floor, Lot FA5 (M-1-6), Lorong City Mall, 88300, Kota KInabalu, Sabah.",Why,kota-kinabalu,4.8,176
4765,24210,"Lot 2-26, 2nd floor, suria sabah shopping mall, Jalan Tun Fuad Stephen, Kota Kinabalu sabah.",I-Medic Repair & Service Specialist,kota-kinabalu,4.8,0
4766,24426,"Sport Complex, 89507 Penampang,  bah",CT Cafe & Steamboat,kota-kinabalu,0,3
4767,24459,"LOT NO , F-43AA-G, Ground Floor, Block F, Pavilion Bundusan, Jalan Bundusan., Penampang",Glasses House,kota-kinabalu,5,12
4768,24497,"Lot 7, First Floor, Block B (B-01-07), Jln Penampang, HS Commercial Center, 89507 Donggongon, Penampang",Elyssa Makeover Studio,kota-kinabalu,5,0
4769,24408,"546, Mile 4 1/2, Jalan Tuaran, Likas, 88400 Kota Kinabalu, Sabah",Pertama Furniture 首邦,kota-kinabalu,0,2
4770,25769,"Lot 16, KK Waterfont, Jalan Tun Fuad Stephen, 88000 Kota Kinabalu, Sabah",Ipong KK,kota-kinabalu,5,1
4771,26512,"Lot S65, Second Floor, Imago Mall, KK Times Square Phase 2, Off Coastal Highway, 88100 Kota Kinabalu, Sabah",OGAWA,kota-kinabalu,4.9,0
4772,26513,"Lot M-0-44, Ground Floor, City Mall, Lorong City Mall, Off Jalan Lintas, 88300 Kota Kinabalu, Sabah.",OGAWA,kota-kinabalu,4.9,0
4773,26514,"Lot G64, Ground Floor, Kompleks Karamunsing, 88300 Kota Kinabalu, Sabah.",OGAWA,kota-kinabalu,4.9,0
4774,27709,"GROUND FLOOR, LOT G-120, G-121, G-122, 1 BORNEO HYPERMALL, JALAN SULAMAN 88450 KOTA KINABALU, SABAH.",Michelle Shop,kota-kinabalu,0,10
4775,27707,"C-8-1 & C-8-2, Level 8, Block C, Aeropod Commercial Square, Jalan Aeropod Off Jalan Kepayan, 88200, Kota Kinabalu, Sabah.",Mari Jari Beauty,kota-kinabalu,3,0
4776,27801,"Block C, GRound Floor, LOT G13C, D & E ,Karamunsing Complex, Kota Kinabalu, Sabah, Malaysia",Gen.z ( Karamusing) ,kota-kinabalu,4.8,161
4777,27799," I-Plaza, Commercial centre, Lot 14, 1st Floor, Jalan Pintas Penampang 89500 Sabah, Malaysia",May's Beauty,kota-kinabalu,2,0
4778,27800,"I-Plaza, Commercial centre, Lot 15 1st Floor, Jalan Pintas Penampang89500 Sabah, Malaysia",Sunshine Studio,kota-kinabalu,4,0
4779,28449,"SHOP NO.1216, GROUND FLOOR, LORONG KELENGKENG, BATU 3 1/4, JALAN TUARAN, 88400 KOTA KINABALU SABAH.",Oasis.Succulent,kota-kinabalu,4.9,46
4780,28566,"Ground Floor, Lot 13, Bornion Centre, Luyang, 88300 Kota Kinabalu, Sabah.",WANG XIANG,kota-kinabalu,0,0
4781,28448,"GROUND FLOOR, LOT 39, DBKK NO 6-0, LORONG LINTAS PLAZA 3, LINTAS PLAZA, KOTA KINABALU .",Majestea,kota-kinabalu,4.7,545
4782,28516,"Block C12,GROUND FLOOR,PERTAMA LIGHT INDUSTRIAL S OFF 87007, W.P, 706, 87000 Labuan, Labuan Federal Territory",LOVE PETS FAMILY,kota-kinabalu,0,0
4783,25847,"BLOCK I, GROUND FLOOR, LOT 68,SHOP DBKK NO.10-10, RUANG LINTAS SQUARE, LINTAS SQUARE,JLN LINTAS, 88300 KK",1863 Patiserrie & Cafe,kota-kinabalu,4.7,561
4784,28291,"LOT 3-0, GROUND FLOOR, LORONG LINTAS PLAZA, JALAN LINTAS, 88300 KOTA KINABALU, SABAH",Travel For All,kota-kinabalu,4.6,21
4785,28289,"Ground Floor (Shop 7), Lot U0210, Jalan Bahasa,  87000 Willayah Perseketuan Labuan, Malaysia.",Travel For All,kota-kinabalu,4.6,0
4786,28290,"LOT NO P1C, 4TH FLOOR, PALM SQUARE, CENTRE POINT KOTA KINABALU, 88000 SABAH",Travel For All,kota-kinabalu,4.6,1
4787,25778,"UNIT NO.G-700 GROUND FLOOR, 1BORNEO HYPERMALL, JALAN SULAMAN,KOTA KINABALU",JR Optical,kota-kinabalu,4.7,12
4788,25780,"UNIT NO. C-700 KIOSK , BASEMENT FLOOR, 1BORNEO HYPERMALL , JALAN SULAMAN, KOTA KINABALU, SABAH.",JR Optical,kota-kinabalu,4.7,16
4831,23818," Lot 52, Ground Floor, Lorong Avenue 2, 90000 Sandakan",Crowd 99 Cafe,sandakan,4.7,947
4789,25779,"UNIT NO. C-706 KIOSK , BASEMENT FLOOR, 1BORNEO HYPERMALL , JALAN SULAMAN, KOTA KINABALU, SABAH.",JR Optical,kota-kinabalu,4.7,4
4790,27301,"Jalan Elektron F U16/F, Denai Alam, 40160 Shah Alam, Selangor.",Cushycandy,kota-kinabalu,4.3,22
4791,27313,"Lot G-51, Ground Floor, ITCC Shopping Mall, Jalan Pintas Penampang,
Kota Kinabalu",KEKOYAJI ,kota-kinabalu,0,2
4792,27345," H82, Lot300, Rumah Murah Sim-Sim Jambatan H, Jalan Buli Sim-Sim Sandakan",Sim-Sim Steam Boat,kota-kinabalu,5,13
4793,28280,"G 111, Ground Floor, 1 Borneo Hypermall, Jalan Sulaman, 88400 Kota Kinabalu Sabah",Travel For All,kota-kinabalu,4.6,0
4794,27065,"First Floor, Lot 1-37, Suria Sabah.",KK CHICK 鸡站,kota-kinabalu,4.4,125
4795,27551,LOT 85 BLOK X TINGKAT BAWAH BANDAR UTAMA ONE AVENUE FASA BATU 6 JALAN UTARA SANDAKAN,Rainbow.com,kota-kinabalu,4.5,209
4796,27550,"Lot 34, Ground Floor,, Damai Plaza Luyang,, 88300 Kota Kinabalu, Sabah",Santinos Pizza (Damai),kota-kinabalu,4.2,0
4797,29238,"19, Jalan Coastal, 88000 Kota Kinabalu, Sabah, Malaysia",LEGO (R) Certified Store,kota-kinabalu,4.8,0
4798,29321,"Lot 52-2, Block F 2nd Floor, Austin Business Park, Mogonibung, Penampang, 88300 Kota Kinabalu, Sabah",Girls Beauty,kota-kinabalu,0,0
4799,30537,"Lot 55 DBKK, No 27-0 Ground Floor, Lorong Lintas Plaza, Lintas Plaza 2, Lintas Plaza, Luyang 88200,Kota Kinabalu, Sabah, Malaysia",Qian Xu Duck Noodles,kota-kinabalu,4.5,71
4800,29439,"Tembara River Cruise, Jalan Benakal, Kampung Serusup, P. O. Box 232, 89208 Tuaran, Sabah, Malaysia",Tembara River Cruise,kota-kinabalu,0,2
4801,29525,"BLOCK E, GROUND FLOOR , LOT 40, DBKK NO 34-0  DAMAI PLAZA, PHASE 4, OFF Jalan Damai, , Kota Kinabalu, Sabah, Malaysia",Gen.z ( Damai ) ,kota-kinabalu,4.7,363
4802,30756,"Lot No. E-36, Ground Floor, Block No. E, Type 1, Pavillion Bundusan, Jalan Bundusan, Penampang, Sabah, Malaysia",Taken-T,kota-kinabalu,0,0
4803,29322,"ground floor, Lot 27, 28, block C, Lorong Plaza 333-2, 89500 Kota Kinabalu, Sabah",Teppanya Cafe & Bar KK,kota-kinabalu,4.5,182
4804,29319,"Lot 3.51, 3rd Floor, Karamunsing Complex, 88300, Kota Kinabalu, Sabah, 88400 Kota Kinabalu, Sabah",PC Image (1),kota-kinabalu,4.9,11
4805,30999,A-7-G G BLOK A JALAN PAVILION BUNDUSAN 3 88300 PENAMPANG SABAH,Qiao Xu Duck Noodles (Pavillion),kota-kinabalu,0,2
4806,22969,"SPK 1-01, First Floor Imago Shopping Mall KK Times Square, Phase 2, Off Coastal Highway, 88100 Kota Kinabalu, Sabah",Juice Works,kota-kinabalu,4.6,140
4807,22979," J4, 1st Floor, Suria Sabah Shopping Mall, 1, Jalan Tun Fuad Stephens, Pusat Bandar Kota Kinabalu, 88000 Kota Kinabalu, Sabah.",Joox Cafe & Cowdung Tart,kota-kinabalu,4.2,76
4808,22978,"Lot 68, Ground Floor, Block H, Plaza 333, Kobusak Commercial Centre, Jalan Pintas, 89500 Penampang, Sabah",Joox Cafe & Cowdung Tart,kota-kinabalu,4.2,319
4809,22889,"NO. 11-0, Lot 6, Ground Floor, Lorong Lintas Plaza, Lintas Plaza,88300, Kota Kinabalu, Sabah",JC Golden Sand,kota-kinabalu,0,0
4810,23389,"Outlet locations are not fixed. GPR food trucks travel through Kuala Lumpur, Johor, Melaka, Penang, Kedah, Kota Kinabalu, and Kuching and rotate between locations.",GPR Foods (Food Truck),kota-kinabalu,5,0
4811,23391,"Outlet locations are not fixed. GPR food trucks travel through Kuala Lumpur, Johor, Melaka, Penang, Kedah, Kota Kinabalu, and Kuching and rotate between locations.",GPR Foods (Food Truck),kota-kinabalu,5,0
4812,23393,"Outlet locations are not fixed. GPR food trucks travel through Kuala Lumpur, Johor, Melaka, Penang, Kedah, Kota Kinabalu, and Kuching and rotate between locations.",GPR Foods (Food Truck),kota-kinabalu,5,0
4813,23388,"Outlet locations are not fixed. GPR food trucks travel through Kuala Lumpur, Johor, Melaka, Penang, Kedah, Kota Kinabalu, and Kuching and rotate between locations.",GPR Foods (Food Truck),kota-kinabalu,5,0
4814,23390,"Outlet locations are not fixed. GPR food trucks travel through Kuala Lumpur, Johor, Melaka, Penang, Kedah, Kota Kinabalu, and Kuching and rotate between locations.",GPR Foods (Food Truck),kota-kinabalu,5,0
4815,23392,"Outlet locations are not fixed. GPR food trucks travel through Kuala Lumpur, Johor, Melaka, Penang, Kedah, Kota Kinabalu, and Kuching and rotate between locations.",GPR Foods (Food Truck),kota-kinabalu,5,0
4816,23411,"Outlet locations are not fixed. GPR food trucks travel through Kuala Lumpur, Johor, Melaka, Penang, Kedah, Kota Kinabalu, and Kuching and rotate between locations.",GPR Foods (Food Truck),kota-kinabalu,5,0
4817,23358,"Lintas driving range,lorong lintas plaza 4,88300 kk Sabah",TVL Trading,kota-kinabalu,5,36
4818,23574,"Phase 2, Ground Floor, Lot 4, Jalan Lintas, Kolam Centre, Luyang Commercial Centre, 88300 Kota Kinabalu, Sabah",TOYS BROTHERS,kota-kinabalu,0,3
4819,21773,"KPJ Sabah Specialist Hospital, Lobby A, Lot No. 2 & 3, Off Jalan Damai, Jalan Bersatu, Luyang, 88300 Kota Kinabalu, Sabah",Starbucks,kota-kinabalu,4.4,0
4820,21766,"Unit G-832, F-832, & F832A, Ground & First Floor, One Borneo Hypermall, Jalan Sulaman, 88000 Kota Kinabalu, Sabah.",Starbucks,kota-kinabalu,4.4,0
4821,21768,"G-2 & G-69, Ground Floor, Suria Sabah Shopping Mall, Jalan Tun Fuad Stephen, Pusat Bandar Kota Kinabalu, 88000 Kinabalu, Sabah",Starbucks,kota-kinabalu,4.4,0
4822,21767,"Lot L3A01, Level 3, Airside, Terminal 1, Kota Kinabalu International Airport, 88740 Sabah.",Starbucks,kota-kinabalu,4.4,0
4823,21770,"Lot G33B & G33C, Ground Floor, Imago, KK Times Square, Off Coastal Highway, 88100 Kota Kinabalu, Sabah",Starbucks,kota-kinabalu,4.4,0
4824,21771,"L1L10, Level 1 (Landside), Terminal 1, 88740 Kota Kinabalu, Sabah",Starbucks,kota-kinabalu,4.4,0
4825,21764,"Lot No.8, Ground & 1st Floor, Block C, Warisan Square, Jalan Fuad Stephen, Pusat Bandar Kota Kinabalu, 88000 Kota Kinabalu, Sabah",Starbucks,kota-kinabalu,4.4,0
4826,16675,"1st Floor, Lot 53, Block R, Bandar Utama One Avenue 9, Lorong Avenue 3, Mile 6 North Road, 90000, Sandakan Sabah.",My Art Studio,sandakan,4.7,0
4827,16607,"1ST FLOOR,LOT 48,BLOCK R,  BANDAR UTAMA,ONE AVENUE 9,  JALAN UTARA,SANDAKAN,SABAH.",My Craft Studio,sandakan,4.8,0
4828,24188,"Lot 132,  Blok 14,Tingkat Bawah Fasa2 , Prima Square  Batu 4,Jalan Utara, 90000, Sandakan, Sabah, ",Kyoto Sushi Japanese Restaurant,sandakan,4.4,96
4829,24453,"Lot 1, Block 19, Indah Jaya Town , Mile 4 North Road 90000 Sandakan",The Boss Fast Food & Juice House,sandakan,0,5
4830,26510,"Lot A13, Ground Floor, Giant Hypermarket Sandakan, Lot 3 Jalan IJM, Bandar Utama, Batu 6, Off Jalan Utara, 90000 Sandakan, Sabah.",OGAWA,sandakan,4.9,0
4832,23917," Lot 126, Ground Floor, One Avenue 4, Bandar Utama, Batu 6, Jalan Utara 90000 Sandakan",Papparato Cafe,sandakan,4.4,239
4833,21307,"Jalan Taman Utama, 90000 Sandakan, Sabah, Malaysia",Survivor Island (Sabah Booking),sandakan,0,0
4834,23956,"G Floor, Lot 1, Block, I, Sibuga Jaya Commercial Centre, Mile, 8, Jalan Lintas Labuk, 90000 Sandakan, Sabah",Karamell Almondo Sandakan,sandakan,4.7,160
4835,23959,"Sandakan Airport, 90000 Sandakan, Sabah, Malaysia",Karamell Almondo Sandakan,sandakan,4.7,30
4836,23957,"Lot 2k3, 2nd Floor, Harbour Mall Sandakan, Wisma Harbour Mall, 90000 Sandakan ",Karamell Almondo Sandakan,sandakan,4.7,15
4837,23958,"LOT 1 BLOK 1 TINGKAT BAWAH SIBUGA JAYA,COMMERCIAL CENTRE  FASA 2, JALAN LABUK SANDAKAN.",Gen.z (Sandakan),sandakan,4.7,373
4838,24109,"Lot 9, Block 26, Ground Floor, Jalan Utara, Mile 4, Bandar Indah, Sandakan, 90000",Little Nanyang,sandakan,4.7,284
4839,17370,"Block 18, Lot 161, Ground Floor, Phase II, Prima Square, Mile 4, Jalan Utara, 90000, Sandakan Sabah.",Kenny Rogers ROASTERS,sandakan,4,0
4840,6472,"Lot 2, Block 14, Bandar Indah 90000 Sandakan",Pathlab,sandakan,3.8,0
4841,17371,"Lot G-13, Ground Floor, Harbour Mall Sandakan, Sandakan Harbour Square, 90000 Sandakan, Sabah.",Kenny Rogers ROASTERS,sandakan,4,0
4842,23927,"LOT 40, BLOK E, TINGKAT BAWAH , BANDAR  PERDANA  BATU 7 JALAN AIRPORT, SANDAKAN.",Summer Joy,sandakan,4.7,786
4843,23926,"LOT 1 BLOCK 12 TINGKAT BAWAH,BANDAR INDAH,  BATU 4, JALAN UTARA SANDAKAN",Summer Joy,sandakan,4.7,95
4844,23936,Blok 26 Lot 2 Bandar Indah Jalan Labuk Batu 4 Sandakan ,7-Heaven Crunchy Chicken,sandakan,4.5,222
4845,23985,Outlet locations are not fixed. Karamell Almond food trucks travels throughout Sandakan.,Karamell Almondo Sandakan,sandakan,4.7,128
4846,23935,"LOT 3 BLOK 26 TINGKAT BAWAG BANDAR INDAH BATU 4, JALAN UTARA SANDAKAN ",7- Heaven Dessert Parlor,sandakan,4.5,610
4847,23898,"LOT 209,LOT210 DAN LOT 211, BLOCK EE TINGKAT BAWAH,BANDAR UTAMA, ONE AVENUE PH10, BATU 5, JALAN UTARA SANDAKAN",New King City Seafood Restaurant,sandakan,4.3,225
4848,23892,"Lot 10, Ground Floor, Floor, IJM Utama Zone3 Commercial, Jalan Dataran BU 2, North Road 90000 Sandakan",Rusteak Grill,sandakan,0,4
4849,23844,"Lot 97, Ground Floor, Block K, Lorong Avenue 4, 90000 Sandakan",Truffles Cafe,sandakan,4.5,93
4850,23847,"LOT 57 BLOCK W, TINGKAT BAWAH,BANDARUTAMA,ONE AVENUE 10, BATU 6, JALAN UTAMA SANDAKAN",Up Case Cafe,sandakan,4.8,578
4851,23846," Lot 123, Ground Floor, Block AA, Lorong Avenue 4, Bandar Utama 90000 Sandakan",The Mad Hatter,sandakan,2,7
4852,23849,"LOT 8, BLOCK D, BANDAR UTAMA, ONE AVENUE,PHASE 8, MILE 6 JALAN UTARA,9000 SANDAKAN",Koi Sushi Japanese Restaurant,sandakan,3.6,31
4853,23966,"Avenue 3, Bandar Utama,90000 Sandakan, Sabah",Mell's Fresco Bites Cafe,sandakan,4.6,45
4854,23977,"LOT 4B BLOK19,TINGKAT BAWAH, JALAN 2, PUSAT BANDAR SANDAKAN.",E - Century Communication,sandakan,0,3
4855,23969,"Lot 23, Block T , Bandar Utama , Avenue 9, 90000 Sandakan",Fruits World Drink House,sandakan,4.7,935
4856,23971,Lot 9 Blok Y TINGKAT BAWAH ONE AVENUE 10 SANDAKAN,包二爺·老媽子炸肉粉 Lao Ma Zi Fried Pork Noodle,sandakan,4.6,418
4857,23975,"LOT 8 BLOK TINGKAT BAWAH ,BANDAR  KIM FUNG, BATU 4, JALAN UTARA SANDAKAN ",E - Century Communication,sandakan,0,2
4858,23973,"Block A, Ground Floor, Lot SO202, One Avenue 8, Bandar Utama 90000 Sandakan",Iogurt Cafe,sandakan,4.8,832
4859,23976,"316, 317,318, 3TH FLOOR, HARBOUR MALL, SANDAKAN.",E - Century Communication,sandakan,0,4
4860,23968,"LOT 91 BLOK B, TINGKAT BAWAH, SEJATI WALK,BATU 7, JALAN AIRPORT, SANDAKAN. ",HI TEA,sandakan,4.5,241
4861,23972,"LOT 13 BLOK 2,TINGKAT BAWAH, PRIMA SQUARE, BATU 4, JALAN UTARA,SANDAKAN.",Brew Cottage,sandakan,4.8,401
4862,23845," LOT 200 BLOCK 20,TINGKAT BAWAH,PRIMA SQUARE FASA 3, BATU 4 JALAN UTAMASANDAKAN",Tea Day,sandakan,4.6,740
4863,24596,"Block S Lot 45 Lorong Avenue 2 Bandar Utama Mile 6, Sandakan.",Cecily's Fashion Accessories,sandakan,4,11
4864,34242,"Lot A4, Ground Floor,GIANT Hypermarket Sandakan,Lot 3 Jalan IJM, Bandar Utama,Batu 6, Off Jalan Utara,90000 Sandakan, Sabah",ITSU,sandakan,3.7,0
4865,17612,"TB14105, Lot 1, 2nd Floor, Mile 2 3/4, Jalan Datum Chong Thein Vun 91000 Tawau Sabah",My Art Studio,tawau,4.7,0
4866,31086,"Lorong Perdana Jaya 9, Jalan Ching Thien Vun, 91000,Tawau, Sabah, Malaysia",Taste Two Coffe House,tawau,0,0
4867,25170,"TB27, E4, Block E, Ground Floor, Kubota Sentral, Jalan Chong Thien Vun, 91000 Tawau, Sabah",Horizon Cafe,tawau,4.9,904
4868,25167,"no.61-0,Kubota Sentral, Jalan Kubota, 91000 Tawau, Sabah",90's Bakery & Cafe,tawau,4.8,437
4869,25177,"TB 16314, LOT 15, BANDAR PERDANA JAYA,MILE 3 1/,JLN APAS, 91000,TAWAU, SABAH",Gu Zar Bee 古早味,tawau,4.5,1056
4870,25221,"Lot G1, TB34-0 & TB34-2, Kubota Sentral, Jalan Chong Thien Vun, Tawau",Cakes & Co,tawau,4.4,36
4871,25222,"TB34-0 & TB34-2, Kubota Sentral, Jalan Chong Thien Vun, Tawau",Cakes & Co,tawau,4.4,149
4872,25169,"Pusat Komersial BDC, 91000 Tawau, Sabah",Chillax,tawau,0,2
4873,25171,"TB19293, Ground Floor, Block B, Pusat Komersil Bintang Kubota,KM 5 Jalan Chong Thien Vun, Tawau",Signature Cafe,tawau,4.8,380
4874,25174,"TB 15580-0, LOT 35, GROUND FLOOR, KUBOTA SQUARE, JALAN KUBOTA, 9100, TAWAU, SABAH.",ZenQ,tawau,4.7,194
4875,25455,"TB4701, GROUND FLOOR, 3 STOREY COMM BUILDING , JALAN HAJI KARIM, 91000,TAWAU",Kurtos Spiroll Tawau,tawau,5,44
4876,25176,"TB 16314, LOT 16, BANDAR PERDANA JAYA,MILE 3 1/,JLN APAS, 91000,TAWAU, SABAH",Han's Bakery,tawau,4.8,2320
4877,25175,"TB 14108,Mile 2 3/4, Jalan Datuk Chong Thien Vun,91000 Tawau, Sabah",Wukka Cafe,tawau,4.5,323
4878,25172,"No 19300, Lot 1, Block c, Pusat Komersil Bintang Kubota , Jalan Datul Chong Thien Vun,91000, Tawau, Sabah.",Bing Cafe,tawau,4.7,365
4879,25173,"TB L8,Lot D18-0, Block D, Kubota Sentral, Jalan Chong Thien Vun 91000, Tawau",Magic Station,tawau,4.6,308
4880,26511,"Lot G11, Ground Floor, Giant Hypermarket Tawau, CL105466055, KM5 1/2, Jalan Chong Thien Vun, Off Jalan Apas, 91000 Tawau, Sabah.",OGAWA,tawau,4.9,0
4881,25291,Outlet locations are not fixed. Arteasan food trucks travels throughout Tawau.,Arteasan,tawau,4.7,52
4882,25288,"Taman Bandar Semporna, 91308 Semporna, Sabah",London Frozen Yogurt,tawau,4.8,26
4883,25285,"Bandar Tawau, 91000 Tawau, Sabah",Grand Papa,tawau,4.7,13
4885,25286,"CTV Junction, TB14111,, Jalan Chong Thien Vun, 91000 Tawau, Sabah",London Frozen Yogurt,tawau,4.8,267
4886,25284,"Bandar Tawau, 91000 Tawau, Sabah",Grand Papa,tawau,4.7,514
4887,25287,"201, Jalan Haji Karim, Bandar Tawau, 91000 Tawau, Sabah",London Frozen Yogurt,tawau,4.8,185
4888,25292,TB 528，GR FLR，JALAN HAJI KARIM，91000 TAWAU SABAH. Tawau,Dozo Noodle Lab,tawau,5,9
4889,25337,"Taman Emas, 91000 Tawau, Sabah",The Container Café,tawau,5,12
4890,34083,"Restoran Gembira, Jalan Segama, BANDAR TABANAK, Lahad Datu, Sabah, Malaysia",RESTORAN GEMBIRA,tawau,0,1
4891,34012,"MDLD 9499, Lot 3, 1st Floor, Tabanac Industrial Centre, Mile 2, Jalan Segama, 91100 Lahad Datu Sabah",My Art Studio,tawau,4.7,0
4892,33822,"Amber Park Porridge Stall, Tawau, Sabah, Malaysia",Amber Park Porridge Stall,tawau,0,0
4893,17127,"
Ground Floor, Lot 95, Section 48, Jalan Green Hill, 93100, Kuching, Sarawak",Ceylonese Restaurant,kuching,4.6,1342
4894,17957,"Vivacity Megamall Lot. L-3-016, Level 3, Vivacity Megamall Jalan Wan Alwi, 93350 Kuching, Sarawak.",Kenny Rogers ROASTERS,kuching,4,0
4895,17953,"Lot S08,2nd Floor AEON Mall Kuching Central,NO.88, Jalan Datuk Patinggi Haji Ahmad Adruce,93200 Kuching, Sarawak",Kenny Rogers ROASTERS,kuching,4,0
4896,13797,"Level 1L, CU20, Jalan Song, One Jaya Commercial Complex, 93350, Kuching, Sarawak",Cuppa Kap Coffee,kuching,4.8,988
4897,14210,"One Jaya Lifestyle Mall, Unit G10, GF, One Jaya, Lot 11430, Block 11, MTLD, Jalan Song, 93350 Kuching, Sarawak.",Sushi Cafe,kuching,5,126
4898,14125,"9, Jalan Bukit Mata Kuching, 93100 Kuching, Sarawak, Malaysia",Ariva Gateway Kuching Serviced Residences,kuching,0,0
4899,14180,"No.20, Ground Floor, Tabuan Height Commercial Centre, Jalan Song, 93300, Kuching, Sarawak.",Wu Cha 18,kuching,4.3,915
4900,14169,"Lot L1-13 & 14, EG Mall King Centre, Jalan Wan Alwi, 93350 Kuching, Sarawak",Place 2 Chat,kuching,4.2,131
4901,14170,"GK09 & 10, GF, Mall 1, CityOne Megamall, No.1 Jalan Song, 93350 Kuching, Sarawak.",Punjabi Thaali Restaurant,kuching,4.7,859
4902,14192,"GF, Lot 11368, Tabuan Height Phase 7 Commercial Centre, Jalan Song, 93350 Kuching, Sarawak.","MANNA, Pâtisserie, Boulangerie & Cáfe",kuching,4.7,2836
4903,15201,"GF, SL5, Lot 522, Jalan Datuk Tawi Sli, 93250, Kuching, Sarawak",Osome Wood Fired Pizza,kuching,4.6,367
4904,18072,"Ground Floor, Sublot 69, Jalan Datuk Mohd. Musa, Desa Ilmu Phase 25, 94300, Kuching, Sarawak",Ultimate PC Dynamic,kuching,0,0
4905,18101,"Tower Market Hawker Centre, Stall No.30, Jalan Power, 93000, Kuching, Sarawak ",新光興 Sin Kwang Heng (Open Air Sio Bee),kuching,4.2,11
4906,18070,"1st Floor, Lot 16806, Block 11, MTLD, 41 Jalan Canna, Tabuan Tranquility Commercial Centre, 93350, Kuching, Sarawak",Glamour Beaute,kuching,4.8,0
4907,18078,"No. 154, Green Road, 93150 Kuching,  Sarawak.",Verthys The Signature,kuching,4.3,0
4908,18196,"Vivacity Megamall Jalan Wan Alwi, 93350 Kuching Sarawak",Neubodi,kuching,4.6,26
4909,17380,"Lot G25, Ground Floor, The Spring Shopping Mall, Persiaran Spring, 93300, Kuching, Sarawak",FitFlop,kuching,4.8,102
4910,17379,"L1-061, Level 1, Vivacity Megamall, Jalan Wan Alwi, 93350, Kuching, Sarawak",Samba,kuching,4.5,117
4911,17378,"Lot 134, 1st Floor, The Spring Shopping Mall, Jalan Simpang Tiga, 93350, Kuching, Sarawak",Samba,kuching,4.5,94
4912,17253,"Lot 145-146 Section 51, KTLD Off Jalan Song Thian Cheok, 93100 Kuching, Sarawak",The AlleyCAT Cafe,kuching,4.1,46
4913,17374,"Lot 1F 117 & 118, 1st Floor The Spring Shopping Mall, Persiaran Spring, 93300 Kuching, Sarawak",Kenny Rogers ROASTERS,kuching,4,0
4914,16970,"KF1, Level 1, The Spring Shopping Mall, Persiaran Spring, 93300 Kuching, Sarawak",FeliMio Gelato,kuching,4.7,331
4915,16969,"10B, Jalan Kempas, 101 Premier Business Centre, 93300, Kuching, Sarawak",Sando Ramen,kuching,4.2,976
4916,18745,"L3-042, Level 3, Vivacity Megamall, 93350, Kuching, Sarawak",Ajisen Ramen,kuching,4.4,688
4917,18743,"No. 73, Lot 5548, Ground Floor, Block 225, Phase 5, Kuching City Mall Commercial Centre, Jalan Datuk Stephen Yong, 93250, Kuching, Sarawak",Chian Nyan Kurobuta Pork,kuching,4.6,663
4918,18770,"Unit 55, Ground Floor - 11430, Block 11, MTLD, OneJaya The Lifestyle Mall, Jalan Song, 93350, Kuching, Sarawak",Beauty Basics,kuching,4.2,0
4919,18735,"No.49 & 50, Ground Floor, Mall 2, CityOne Megamall, No.1, Jalan Song, 93350, Kuching, Sarawak",Meat Up Kitchen & Bar,kuching,4.4,0
4920,17446,"1st Floor, Sublot 10, L12161, Song Plaza, Jalan Tun Jugah, Jalan song, 93350 Kuching, Sarawak",Gourmet Sausage,kuching,4,477
4921,17501,"Ground Floor, S/L 8, Lot 3125-3126, Jalan Tun Ahmad Zaidi Adruce, 93150, Kuching, Sarawak",319 Chin Siang Seafood,kuching,4.6,926
4922,17453,"No.1, Ground Floor, Lot 12168, Song Plaza, Jalan Tun Jugah, Jalan Song, 93250, Kuching, Sarawak",Cafe Cafe,kuching,4.4,2687
